numero,votos_nominais,situacao,nome,nome_urna,sexo,data_nasc,destino_voto,numero_partido
51234,1358,Suplente,AROLDO LEITE,AROLDO TELLES,M,07/04/1967,Válido,51
51555,76,Suplente,EDIENES ROSA DO CARMO,EDIENES HADASSA,F,08/10/1975,Válido,51
51300,147,Suplente,SHIRLEY PEREIRA DE SOUZA FREITAS,SHIRLEY SOUZA,F,04/08/1976,Válido,51
51023,99,Suplente,ALEXSSANDER DOS SANTOS PEREIRA REIS,ALEXSSANDER REIS,M,29/11/1982,Válido,51
51789,511,Suplente,JOSE UBIRAJARA DE ARRUDA NETO,JUCA NETO,M,28/10/1962,Válido,51
51700,19,Suplente,ROSILEIA DO ESPIRITO SANTO SOUZA,ROSE SANTOS,F,30/10/1983,Válido,51
51150,152,Suplente,EDUARDO RODRIGUES TELES,EDUARDO CABELEIREIRO,M,09/08/1969,Válido,51
77190,2199,Eleito,JOELSON FERNANDES DO AMARAL,SARGENTO JOELSON,M,27/10/1977,Válido,77
77065,39,Suplente,GISELE LOPES DA SILVA REZENDE,GISELE LOPES,F,10/07/1982,Válido,77
77555,69,Suplente,JOSIANE FAUSTINO AZEVEDO SABER,DRA JÔ,F,04/05/1981,Válido,77
77000,183,Suplente,MICHELLE MARIE DE SOUZA,MICHELLE MARIE,F,24/11/1978,Válido,77
77123,137,Suplente,ANDERSON ROGERIO DA SILVA PEREIRA,ANDERSON LARA,M,08/08/1981,Válido,77
77890,71,Suplente,VITORIA MARQUES ARAUJO DE SOUZA,SUB TENENTE VITORIA,F,04/11/1976,Válido,77
77013,169,Suplente,SILVANA DAMIELE BARBOSA VIANA,SILVANA VIANA,F,26/09/1988,Válido,77
77999,171,Suplente,RODRIGO GUILHERME DO CARMO DA SILVA SOUZA,RODRIGO GUILHERME VIGILANTE,M,24/08/1993,Válido,77
77333,121,Suplente,JEFERSON JEMES DE PAULA,DJ NERO,M,09/09/1979,Válido,77
77550,174,Suplente,SILVANE SILVA DA LUZ,PROF NINO DA LUZ,M,28/11/1972,Válido,77
77777,1226,Suplente,MARCO AURELIO RIBEIRO COELHO JUNIOR,MARCO AURELIO,M,17/10/1973,Válido,77
77444,2120,Suplente,VINICYUS CORREA HUGUENEY,VINI CLOVITO HUGUENEEY,M,28/06/1990,Válido,77
77011,185,Suplente,RENI BARROS ALMEIDA,RENI BARROS,M,05/10/1980,Válido,77
77321,324,Suplente,MARCELO CONCEICAO DA CUNHA,MARCELO CUNHA,M,15/04/1979,Válido,77
10650,209,Suplente,NILDA LOPES DA COSTA,NILDA TOSCA,F,16/08/1979,Válido,10
10500,72,Suplente,BERENICE DA SILVA LIMA,BERÊ DO MILÊNIO,F,16/05/1969,Válido,10
10020,476,Suplente,MUNIR KASSEN FARES,PROFESSOR MUNIR,M,02/10/1972,Válido,10
10190,677,Suplente,CLAUDIR SANTOS DA ROCHA,CHICO LEBLON,M,13/07/1963,Válido,10
10665,761,Suplente,MARCELO PIRES DE SOUZA,MARCELO PIRES,M,15/07/1973,Válido,10
10789,759,Suplente,MARCOS ANTONIO RIBEIRO DA CRUZ,MARCÃO DO ALHO,M,28/12/1969,Válido,10
10333,843,Suplente,RUBENS DIAS DA SILVA,RUBINHO DA GUIA,M,11/10/1970,Válido,10
10000,1119,Suplente,PAULO CESAR E SILVA,PAULO PEIXE,M,08/08/1971,Válido,10
10666,305,Suplente,EDENIR PEREIRA DA SILVA,DENIS DA SAUDE,M,06/10/1965,Válido,10
10111,133,Suplente,MIRIAN PAES DE BARROS,MIRIAN PAES,F,06/11/1972,Válido,10
10127,185,Suplente,AROLDO SANTANA DE OLIVEIRA,MAESTRO AROLDO SANTANA,M,27/12/1959,Válido,10
10667,1852,Suplente,WELSON MESQUITA DE OLIVEIRA,PROF  WELSON MESQUITA,M,09/03/1967,Válido,10
10999,240,Suplente,NELSON DE FARIA,NELSON DE FARIA,M,12/05/1969,Válido,10
10330,464,Suplente,ALIZANGELA DE SOUZA,MOTORISTA ALIZÂNGELA,F,17/10/1979,Válido,10
10555,251,Suplente,JOÃO CARLOS JOSETTI,JOÃO JOSETTI,M,23/06/1956,Válido,10
10321,516,Suplente,WILLIAM COSTA CAMPOS,WILLIAM CAMPOS,M,15/01/1989,Válido,10
10777,902,Suplente,PATRÍCIA GLÁURA DE ARAÚJO CAMPOS,PATRÍCIA ARAÚJO,F,26/11/1968,Válido,10
10888,130,Suplente,GLÁUCIA HELENA SILVA MARTINS,GLÁUCIA DO CINTURÃO VERDE,F,18/01/1969,Válido,10
10123,2996,Eleito,EDUARDO VICTOR MAGALHÃES,EDUARDO MAGALHÃES,M,20/10/1979,Válido,10
10345,33,Suplente,CRISTIANI APARECIDA GODIM,CRIS GODIM,F,27/06/1985,Válido,10
10744,27,Suplente,JOÃO ALDAIR RODRIGUES,JOÃO RODRIGUES,M,08/04/1967,Válido,10
10110,175,Suplente,EDJANE BRITO GARCIA BOTELHO DA SILVA,EDJANE DA SAÚDE,F,01/03/1981,Válido,10
10987,28,Suplente,ODAIR RIBEIRO DA SILVA,ODAIR RIBEIRO,M,02/11/1969,Válido,10
10222,2060,Eleito,LUIZ FERNANDO GUIMARÃES DE AMORIM,DR LUIZ FERNANDO,M,08/12/1977,Válido,10
10101,65,Suplente,JANETE AUXILIADORA SOARES DE FRANÇA,JAJA DO POVO,F,13/10/1981,Válido,10
10113,229,Suplente,LAERCIO BARBIERI,LAERCIO BARBIERI,M,12/10/1960,Válido,10
10610,807,Suplente,ADMILSON ANTONIO DE ASSIS,SARGENTO ASSIS DO BIGODE,M,04/01/1972,Válido,10
10456,772,Suplente,CLAUDINEY DE OLIVEIRA VIEIRA,CLAUDINEY DO TIJUCAL,M,28/04/1973,Válido,10
10678,534,Suplente,ABEMAEL COSTA MELO,BIMA MELO,M,04/01/1974,Válido,10
10007,482,Suplente,LEDEVINO DA CONCEIÇÃO,LEDEVINO CONCEIÇÃO,M,04/03/1967,Válido,10
10100,639,Suplente,DEVAIR RODRIGUES RIBEIRO,DEVA GAZELLA,M,08/03/1977,Válido,10
10852,106,Suplente,SILVIA MARIA PAPI SANTANA,SILVIA PAPI,F,25/03/1967,Válido,10
10444,563,Suplente,HÉLIO SANTUCHES MEDINA,MEDINA,M,27/08/1969,Válido,10
10612,11,Suplente,MARIA DE FÁTIMA DA CONCEIÇÃO,FÁTIMA PARANÁ,F,13/12/1968,Válido,10
10001,41,Suplente,HIRTO PEREIRA PAIM,PAIM DA AUTO ESCOLA,M,21/12/1961,Válido,10
10010,965,Suplente,JULIO CESAR MAIA PEREIRA,JULIO DA POWER,M,01/06/1984,Válido,10
10144,114,Suplente,ANTONIO CARLOS RAMOS PINTO,ANTONIO RAMOS,M,15/02/1973,Válido,10
10080,345,Suplente,ELICÉIA LOUREIRO TRINDADE,ELICÉIA TRINDADE,F,15/06/1981,Válido,10
