numero,votos_nominais,situacao,nome,nome_urna,sexo,data_nasc,destino_voto,numero_partido
12789,325,Suplente,EDIVALDO ROCHA DOS SANTOS,PROFESSOR EDIVALDO ROCHA,M,19/09/1960,Válido,12
12034,19,Suplente,LUCIANA APARECIDA DO NASCIMENTO,LUCIANA NASCIMENTO,F,12/03/1982,Válido,12
12007,612,Suplente,RUSTISON PEDROSO,MARCELO CUIABANO,M,12/07/1969,Válido,12
12200,21,Suplente,YASMIM ROCHA DA SILVA,YASMIM ROCHA,F,01/04/1999,Válido,12
12180,261,Suplente,AMARANTHA TATYS PEREIRA PINTO,AMARANTHA TATYS,F,08/12/1986,Válido,12
12121,466,Suplente,AURO ELIAS FERNANDES DA SILVA,AURO FERNANDES,M,27/05/1994,Válido,12
12800,59,Suplente,ROBERTINO FRANCISCO SOBRINHO,ROBERTINO DA FARMACIA,M,06/01/1962,Válido,12
12333,219,Suplente,ANDREIA SCHWARZ SANTOS SILVA,ANDREIA SANTOS,F,30/11/1980,Válido,12
12512,89,Suplente,JOCINEIA NEVES DE ARRUDA,JOSI ARRUDA,F,01/04/1974,Válido,12
12000,59,Suplente,MARCELO TERRA DE ALMEIDA,MARCELO TERRA,M,25/05/1974,Válido,12
12300,409,Suplente,DIOGO PEIXOTO BOTELHO,DIOGO BOTELHO,M,10/11/1983,Válido,12
12700,198,Suplente,JEMIMA CAMARGO DE SOUZA,JEMIMA CAMARGO,F,27/05/1986,Válido,12
12345,919,Suplente,MARILDA FATIMA GIRALDELLI,BAIXINHA GIRALDELLI,F,03/10/1962,Válido,12
12100,616,Suplente,RAUNY ALVES DE OLIVEIRA,RAUNY OLIVEIRA,M,14/11/1987,Válido,12
12128,96,Suplente,VIVIANE CRISTINA CANTARELLA,VIVIANE CANTARELLA,F,22/03/1976,Válido,12
12480,8,Não eleito,VANUZA SILVA MENESES,VANUZA MENESES,F,11/12/1995,Anulado,12
12125,193,Suplente,ANDERSON BARBALHO RIBEIRO,ANDERSON BARBALHO,M,25/07/1984,Válido,12
12580,798,Suplente,EVERSON DA SILVA JESUS,JOHNNY EVERSON,M,13/07/1973,Válido,12
12126,178,Suplente,JENIFER DA SILVA GAVILAN,PROFESSORA JENIFER,F,27/02/1989,Válido,12
12555,1757,Eleito,EMANUEL MUSSA AMUI PINHEIRO,LILO,M,10/05/1985,Válido,12
12678,45,Suplente,LOURENCO JOSE FRANZON CALESTINI,LOURENCO FRANZON,M,06/06/1979,Válido,12
12456,187,Suplente,VALDEMIR RODRIGUES PASCOAL,VALDEMIR PASCOAL,M,01/04/1979,Válido,12
12321,176,Suplente,FERNANDO METELLO BELLIDO,FERNANDO METELLO CAXORRÃO,M,26/05/1976,Válido,12
12222,44,Suplente,GILIANE TAINA ALVES DA CRUZ NEVES,TAINA ALVES,F,21/05/1988,Válido,12
12600,737,Suplente,MAURICIO DIAS DE MENDONÇA,MAURICIO DIAS,M,28/02/1982,Válido,12
12123,38,Não eleito,CARLOS CESAR LEITE DE QUEIROZ,CARLOS QUEIROZ,M,18/10/1973,Anulado,12
12012,33,Suplente,JULIO CEZAR DA SILVA MATOS,CEZAR MATOS,M,01/07/1974,Válido,12
11597,24,Suplente,JEANNY ZIEBELL,JEANNY ZIEBELL,F,03/09/1965,Válido,11
11456,24,Suplente,MARIA DE FÁTIMA COSTA CAMPOS,FÁTIMA AUTOESCOLA,F,19/05/1974,Válido,11
11065,69,Suplente,TIARLIS ALVES DE SOUZA,TIARLES RHAVES,M,09/01/1991,Válido,11
11649,48,Suplente,ANGELITA RONDON FORTES,ANGELITA FORTES,F,16/05/1969,Válido,11
11222,2964,Suplente,ALEX RODRIGUES,ALEX RODRIGUES,M,09/07/1988,Válido,11
11211,103,Suplente,IZAQUE DO NASCIMENTO ROSA,PROF. IZAQUE LUX,M,03/05/1981,Válido,11
11322,3001,Suplente,LUIS CLAUDIO DE CASTRO SODRÊ,LUIS CLAUDIO,M,29/04/1966,Válido,11
11000,2276,Suplente,MAURELIO DE LIMA BATISTA RIBEIRO,MAURELIO RIBEIRO,M,17/09/1960,Válido,11
11999,200,Suplente,HANDERSON DE ARRUDA AMORIM,HANDERSON CABELEREIRO,M,30/03/1980,Válido,11
11600,76,Suplente,TAIANA CAROLINE DOS SANTOS PINTO,TAIANA CAROLINE,F,21/01/1987,Válido,11
11010,52,Suplente,DULCELINA GONÇALVES FERREIRA,DULCE GONÇALVES,F,03/08/1964,Válido,11
11500,194,Suplente,LARISSA CARDOSO DE OLIVEIRA GONÇALVES SILVA,LARISSA GONÇALVES,F,25/03/1991,Válido,11
11150,21,Suplente,MARLEUSA DE JESUS PEREIRA DA SILVA,ENFERMEIRA MARLEUSA,F,08/08/1971,Válido,11
11311,79,Suplente,GREICE MARIA NUNES FARES,GREICE FARES,F,16/02/1961,Válido,11
11777,1054,Suplente,ORIVALDO JULIO ALVES,ORIVALDO DA FARMÁCIA,M,12/04/1964,Válido,11
11140,167,Suplente,MARCOS DA SILVA ALBUQUERQUE,MARQUINHOS PQ ATALAIA COXIPÓ,M,03/11/1979,Válido,11
11888,191,Suplente,DAYANNE PRISCILLA ZARK BORGES,DAYANNE ZARK,F,08/10/1987,Válido,11
11001,89,Suplente,ADMIR CONCEIÇÃO MENDES,ADMIR SELVA,M,15/12/1980,Válido,11
11355,66,Suplente,LINDAURA PEREIRA RAMOS,LINDAURA RAMOS,F,11/03/1955,Válido,11
11300,64,Suplente,KYTINÊS DE ALMEIDA LOPES,MIMI DO POVO,F,15/03/1970,Válido,11
11100,242,Suplente,EDISANTOS SANTANA FERREIRA DE AMORIM,EDISANTOS ECONOMISTA,M,15/08/1974,Válido,11
11013,26,Suplente,CARLA RUBIA DA GUIA,CARLÃO,F,19/02/1965,Válido,11
11333,554,Suplente,JAMILSON ADRIANO DE SOUZA MOURA,JAMILSON MOURA,M,02/09/1978,Válido,11
11111,3270,Eleito,DEMILSON NOGUEIRA MOREIRA,DEMILSON NOGUEIRA,M,03/03/1962,Válido,11
11123,3729,Eleito,MARCREAN DOS SANTOS SILVA,MARCREAN SANTOS,M,12/05/1973,Válido,11
22789,30,Suplente,PATRICIA CARMO PEREIRA DA SILVA,PATRICIA PEREIRA ,F,28/08/1985,Válido,22
22622,267,Suplente,DANIEL ROBERTO DA SILVA,DANIEL ROBERTO,M,10/10/1965,Válido,22
22202,108,Suplente,JOSELITA BRUNA CLAUDINO BERNARDES,JOSELITA,F,07/12/1998,Válido,22
22123,1281,Eleito,FRANCISCO CARLOS AMORIM SILVEIRA,CHICO 2000,M,24/03/1955,Válido,22
22777,963,Suplente,EDILSON ODILON DA SILVA,EDILSON ODILON,M,04/10/1975,Válido,22
22122,329,Suplente,LUIZ MARIO DO ESPIRITO SANTO PEREIRA,LUIZ POÇÃO,M,13/12/1961,Válido,22
22321,117,Suplente,JOAQUIM NETO SILVA ARAUJO,PROFº INSTRUTOR JOAQUIM NETO,M,01/01/1977,Válido,22
22065,261,Suplente,CRISTIANO ESPIRITO SANTOS,CRISTIANO PARAQUEDA,M,13/03/1986,Válido,22
22333,34,Suplente,SEBASTIÃO LEMES DE MORAES,SEBASTIÃO MORAES,M,05/08/1970,Válido,22
22200,186,Suplente,DARLEY GONÇALVES FERREIRA,DARLEY GONÇALVES,M,14/04/1986,Válido,22
22580,816,Suplente,LUIZ RICARDO DE OLIVEIRA LOBO,RICARDO LOBO,M,15/07/1974,Válido,22
22022,118,Suplente,ALADIR LEITE ALBUQUERQUE,ALADIR LEITE,M,22/10/1957,Válido,22
22113,221,Suplente,ROSENIL LUIZ DA SILVA,ROSENIL LUIZ CANELINHA DE PACU,M,01/10/1966,Válido,22
22345,38,Suplente,SELMA LUZIA PINHEIRO DA SILVA,SELMA PINHEIRO,F,13/12/1969,Válido,22
22666,65,Suplente,LUCELIA PEREIRA NEVES,LUCELIA NEVES,F,12/01/1974,Válido,22
22722,22,Suplente,BENEDITA LUZIA DUARTE,BENE,F,28/10/1954,Válido,22
22180,132,Suplente,CLAUDENIR COELHO MARÇAL,KALL MARÇAL,F,25/09/1973,Válido,22
22226,40,Suplente,MARIA APARECIDA RIBEIRO DA SILVA,IRMÃ CIDA,F,03/01/1971,Válido,22
22700,26,Suplente,ISATELMA DE OLIVEIRA LARA SILVA,ISATELMA LARA,F,28/12/1970,Válido,22
22555,252,Suplente,VALNEY SOUZA CORREA,VALNEY,M,08/09/1972,Válido,22
22000,562,Suplente,JUSTINO MACIEL DE CAMPOS,JUSTINO CAMPOS,M,26/02/1965,Válido,22
22111,112,Suplente,BENEDITO PAULO NUNES DE ABREU,DITO PAULO BOTAFOGO,M,25/01/1959,Válido,22
22456,315,Suplente,JANIE BATISTA COSTA,JANIÊ ,F,22/11/1970,Válido,22
22100,419,Suplente,GERSON JOÃO DE ARRUDA,GERSON ARRUDA,M,31/07/1972,Válido,22
22007,337,Suplente,RAFAEL LEONILSON OLIVEIRA SILVA,RAFAEL FARÉ,M,03/04/1990,Válido,22
22023,250,Suplente,DIOGO CESAR FERNANDES,DIOGO FERNANDES,M,04/02/1984,Válido,22
22155,49,Suplente,MESSIAS ARRUDA DE AGUIAR,MESSIAS ARRUDA,M,15/09/1984,Válido,22
22222,264,Não eleito,JOSE MARCONDES DOS SANTOS NETO,MUVUCA,M,02/05/1975,Anulado,22
22424,105,Suplente,SEBASTIÃO BATISTA DA CRUZ,SEBASTIÃO PICINHA,M,26/03/1969,Válido,22
22050,19,Suplente,SOLANGE ALVES FEITOZA,SOLANGE FEITOZA,F,09/02/1971,Válido,22
22665,153,Suplente,JOSÉ ZACARIAS DE OLIVEIRA,ZÉ DO PICOLÉ,M,25/09/1962,Válido,22
65090,337,Não eleito,ANDRÉ AUGUSTO SIRICO,ANDRÉ DA CLARO DO PEDRA,M,03/11/1986,Válido,65
65123,43,Não eleito,JOSÉ PEREIRA FILHO,JOSÉ PEREIRA,M,07/10/1961,Válido,65
65555,55,Não eleito,GIULIANO ROBLEDO ZUCOLOTO MOREIRA,PROFESSOR GIULIANO,M,03/09/1983,Válido,65
65180,99,Não eleito,DANIFAN MADALENA CUNHA LEITE,DANIFAN,F,29/09/1994,Válido,65
65223,17,Não eleito,JANA BENEDITA SOARES DA SILVA,JANA,F,22/03/1980,Válido,65
65065,93,Não eleito,NADIELE ESTEFFANI CALDAS QUEIROZ,NADIELE,F,03/04/1988,Válido,65
65500,46,Não eleito,ROSELI APARECIDA DE SIQUEIRA,ROSELI,F,11/10/1967,Válido,65
65165,23,Não eleito,SANDRA MARIA ALMEIDA DOS SANTOS,PROFESSORA SANDRA MARIA,F,13/04/1960,Válido,65
65608,57,Não eleito,KELVIN CAMPOS DIAS MOURA,KELVIN,M,18/11/1995,Válido,65
65507,37,Não eleito,UESLE LUCAS OJEDA BARROS,LUCAS OJEDA,M,29/12/1987,Válido,65
65252,13,Não eleito,SEBASTIÃO DE ALMEIDA ANDRADE,TIÃO VIGILANTE,M,25/09/1960,Válido,65
65432,36,Não eleito,VANDERSON GUIA DE SOUZA,VANDO PNEUS,M,20/09/1979,Válido,65
65024,42,Não eleito,RONE MARCOS BATISTA DE PÁDUA,PROFESSOR RONE DE PÁDUA,M,26/05/1970,Válido,65
65300,224,Não eleito,IVANE INEZ PIAIA,PROFª IVANE PIAIA,F,07/04/1960,Válido,65
65321,182,Não eleito,ANDRÉA DOS SANTOS,PROFESSORA ANDRÉA SANTOS,F,02/06/1973,Válido,65
65789,72,Não eleito,THIAGO FERNANDES MOTA,THIAGO MOTA,M,02/05/1986,Válido,65
65026,67,Não eleito,BENITEZ UBIRATAN SOUZA DA SILVA,BIRA,M,26/10/1978,Válido,65
65700,71,Não eleito,CLAUDETE BENEDITA DE AZEVEDO,CLAUDETE,F,31/12/1970,Válido,65
35035,11,Não eleito,KATIA AUXILIADORA DE AMORIM ALVES,KATIA AMORIM,F,16/06/1972,Válido,35
35009,0,Não eleito,ELIZABEL DA SILVA,ELIZABEL,F,02/10/1950,Válido,35
35060,0,Não eleito,JOSE RIBEIRO NEVES,JOSE RIBEIRO ,M,19/10/1967,Anulado,35
35000,86,Não eleito,TACIANNE DA SILVA,TACIANNE SILVA,F,12/01/1985,Válido,35
35010,0,Não eleito,MILTON APARECIDO SANT'ANA,MILTON,M,20/07/1970,Válido,35
35036,3,Não eleito,MAIRDES MIRTES DA SILVA AMORIM,MILDES,F,07/08/1970,Válido,35
35073,7,Não eleito,ANA CAROLINA COSTA OLIVEIRA,ANA CAROLINA COSTA,F,18/10/1977,Anulado,35
35040,0,Não eleito,JOSE EDER MONTE DA CRUZ CASTRO,JOSE EDER MONTE,M,20/06/1982,Válido,35
35001,2,Não eleito,ADRIANA GLERIAN SILVA MEIRA,ADRIANA GLERIAN,F,15/03/1976,Válido,35
35020,7,Não eleito,DANIEL PEREIRA SOARES SOUZA,DANIEL SOUZA,M,23/05/1990,Anulado,35
35025,0,Não eleito,ANA MARIA PEDROSO,ANA PEDROSO,F,18/11/1962,Válido,35
35003,21,Não eleito,MARIOVAN WILLIAM CONSTANTINO,MARIOVAN,M,24/01/1986,Anulado,35
35038,4,Não eleito,LEIDIANE PAZ LEANDRO,LEIDIANE PAZ,F,05/03/1984,Válido,35
36777,260,Não eleito,HELLEN MARLEY DA SILVA ANUNCIAÇÃO,ENFERMEIRA HELLEN,F,05/02/1964,Válido,36
36226,19,Não eleito,EDUARDO BOSCO DA SILVA,EDU CHOCOLATE,M,13/04/1982,Válido,36
36926,9,Não eleito,MARTHA ALCIONE FRANCO,MARTHA ALCIONE,F,24/01/1972,Válido,36
36300,140,Não eleito,BENEDITO ROBSON MONTEIRO DE ANDRADE,PROFESSOR ROBSON,M,12/12/1962,Válido,36
36400,49,Não eleito,WENDERS SEBASTIÃO DIAS DE ARAUJO,WENDERS FOTOGRAFO,M,11/01/1996,Válido,36
36555,61,Não eleito,ELENICE MARIA DA SILVA,ELENICE SILVA,F,20/11/1966,Válido,36
36987,136,Não eleito,MARCELO JOSÉ HARDMAN MEDINA,BOB MEDINA,M,02/09/1976,Válido,36
36200,1428,Não eleito,EDEMIR CLAUDIO XAVIER,DR XAVIER,M,26/01/1966,Válido,36
36367,127,Não eleito,JOSE LITO TAPAJOS,ZELITO TAPAJOS,M,07/10/1960,Válido,36
36020,54,Não eleito,ROSA MARIA MARQUES,ROSA MARIA,F,10/03/1958,Válido,36
36121,40,Não eleito,ODAILSON NUNES DOS SANTOS,PROFESSOR PRETO,M,12/10/1975,Válido,36
36321,37,Não eleito,KLEBER CORREA ZAEZAE,ZAEZAÉ,M,31/05/1993,Válido,36
36536,78,Não eleito,PATRÍCIA REGINA DA SILVA BOTTA,PATRÍCIA SILVA,F,12/08/1985,Válido,36
36001,30,Não eleito,DORACY PEREIRA DE MOURA CAMPOS,DORACY PEREIRA,F,01/10/1961,Válido,36
36456,771,Não eleito,NEWTON CESAR PEREIRA,NEWTON BENGUÉ,M,14/04/1978,Válido,36
36123,207,Não eleito,CARLOS YUHITI HIROSE,CARLOS DA LUNÓTICA,M,27/11/1961,Válido,36
36166,23,Não eleito,MILER MIRANDA DE CAMPOS,PROFESSORA MILER,F,07/10/1963,Válido,36
36100,84,Não eleito,CLEBER DIEGO ADORNO MOURA,CLEBER ADORNO,M,10/07/1987,Válido,36
36362,2,Não eleito,ANA CAROLINA PALHARES DA SILVA,ANA CAROLINA,F,19/02/1984,Válido,36
36111,113,Não eleito,JOSÉ CARLOS RODRIGUES DA SILVA,PROFESSOR CARLÃO DO OCTACÍLIO,M,24/03/1962,Válido,36
36361,86,Não eleito,DANIEL MARTINS DOS SANTOS,DANIEL MARTINS,M,08/09/1977,Válido,36
36000,615,Não eleito,WILLYS JORGE MARTINS,WILLYS,M,23/04/1987,Válido,36
36036,392,Não eleito,ANTONIO CESAR DA SILVA,TOTO CESAR,M,14/09/1974,Válido,36
36369,450,Não eleito,LEIDIANE DOS SANTOS SOUZA,LEIDIANE VIDAL,F,30/07/1987,Válido,36
36789,404,Não eleito,MAURILIO MARCIO POUSO,MAURO POUSO,M,07/05/1964,Válido,36
36013,23,Não eleito,HERCILENA LOPES,PARAGUAIA,F,19/09/1955,Válido,36
36999,105,Não eleito,ELTON ALVES DE ANDRADE,PROFESSOR ELTON,M,20/06/1965,Válido,36
36222,48,Não eleito,CARLOS ROBERTO DA SILVA,CARLOS ROBERTO,M,22/02/1985,Válido,36
36070,89,Não eleito,VALTER MARTINS DOS REIS,WALTER BABILÔNIA,M,09/12/1970,Válido,36
36021,6,Não eleito,ANA CATARINA ANTUNES DA CRUZ,CATARINA,F,19/07/1971,Válido,36
36573,85,Não eleito,ELIETE SOARES DA SILVA,ELIETE SOARES,F,24/06/1968,Válido,36
36500,207,Não eleito,VERGILIO DE ARRUDA FILHO,VERGÍLIO DE ARRUDA,M,08/09/1971,Válido,36
13777,105,Não eleito,ANTONIA VANDA DE SOUZA CURVO,VANDA DA FEIRA,F,01/06/1971,Anulado,13
13123,242,Suplente,BENEDITO JOÃO DE SANTANA,PROF DITINHO SANTANA,M,15/11/1968,Válido,13
13222,117,Suplente,CHIRLEI PEREIRA DOS SANTOS,CHIRLEI PEREIRA,F,24/10/1982,Válido,13
13100,101,Suplente,VALTER JOSE SANDRO FARIA,VALTER SANDROBAR,M,26/09/1979,Válido,13
13566,248,Suplente,DENILSON D'ARC SILVA DE OLIVEIRA,DENILSON D'ARC,M,20/04/1999,Válido,13
13678,362,Suplente,GERMANIO DE ARAUJO,GERMANIO DE ARAUJO,M,11/04/1978,Válido,13
13200,106,Suplente,CLAUDIONILTON CARDOSO,CLAUDIO CARDOSO,M,05/05/1981,Válido,13
13130,74,Suplente,URBANO RIBEIRO DOS REIS,INDIO DO BRASIL PT,M,02/04/1950,Válido,13
13987,25,Suplente,ADENIZE IZADORA PINTO ALMEIDA,ADENIZE,F,04/04/1979,Válido,13
13456,265,Suplente,VALDINA DA SILVA FERREIRA,KACO DO CPA,M,23/05/1974,Válido,13
13813,65,Suplente,MARIA DA CONCEIÇÃO SANTOS CORTEZ,KOTA CORTEZ,F,08/12/1971,Válido,13
13333,92,Suplente,HENIO PINTO DE ARRUDA,HÊNIO ARRUDA,M,14/03/1961,Válido,13
13789,100,Suplente,TELMA SEVERINA DOS REIS RODRIGUES,TELMA REIS,F,21/06/1974,Válido,13
13530,221,Suplente,JOSE ALVES DE MIRANDA,ANJINHO DO GÁS,M,24/10/1978,Válido,13
13003,37,Suplente,DEJANIRA ANGELINA DA SILVA,DEJANIRA ANGELINA ,F,17/03/1953,Válido,13
13150,310,Suplente,ANTONIO CARLOS DE OLIVEIRA,ANTONIO CARLOS BILA,M,10/01/1967,Válido,13
13007,100,Suplente,ALLEXANDRE BLANCO RODRIGUES OLIVEIRA,ALLEXANDRE JACARÉ,M,30/08/1982,Válido,13
13013,927,Suplente,ROBINSON CIREIA DE OLIVEIRA,PROF ROBINSON CIREIA,M,17/08/1977,Válido,13
13555,220,Suplente,MARCOS VIANA,MARCOS VIANA LUCIO SOM,M,07/12/1971,Válido,13
13131,2902,Eleito,EDNA LUZIA ALMEIDA SAMPAIO,EDNA SAMPAIO,F,24/02/1967,Válido,13
13301,545,Suplente,FABIO MATOS DA SILVA,FABIO GAUCHO,M,06/05/1972,Válido,13
13000,276,Suplente,GABRIEL HENRIQUE CARMO E SILVA,GABRIEL HENRIQUE,M,13/01/1996,Válido,13
13234,197,Suplente,ANTONIA MARTA DA ROCHA,MARTA ROCHA,F,13/01/1962,Válido,13
13567,105,Suplente,CRISTIAN FERNANDO OLIVEIRA MOTA,CRISTIAN FERANDO,M,09/08/1984,Válido,13
13999,155,Suplente,ALDI GOMES,ALDI GOMES,M,04/06/1963,Válido,13
13654,148,Suplente,ANTONIO DOMINGOS DA SILVA,DOMINGOS DO TRANSPORTE,M,24/07/1963,Válido,13
43789,1782,Suplente,RAUFRIDES MACEDO,RAUF MACEDO,M,11/06/1965,Válido,43
43667,77,Suplente,CLEONICE RAMOS,CLEONICE RAMOS,F,04/04/1973,Válido,43
43300,88,Suplente,ODILZA TEREZINHA DA SILVA,ODILZA PRETA,F,24/09/1974,Válido,43
43666,1257,Suplente,JUSTINO MALHEIROS NETO,JUSTINO MALHEIROS,M,14/03/1972,Válido,43
43024,217,Suplente,GILMAR DOS SANTOS,GILMAR SANTOS,M,20/09/1976,Válido,43
43650,95,Suplente,LOURDES TRINDADE SILVA DORILEO,LOURDES DORILEO,F,26/04/1963,Válido,43
43000,715,Suplente,ELZIO JOSÉ DA SILVA VELASCO,ELZIO XAULIN,M,07/03/1971,Válido,43
43043,1629,Suplente,CLEY ROBERTO FERNANDES DA SILVA,ROBERTINHO FERNANDES,M,13/05/1970,Válido,43
43456,1427,Suplente,MARCOS AURELIO VELOSO E SILVA,DELEGADO MARCOS VELOSO,M,22/02/1963,Válido,43
43678,102,Suplente,MARLUCIANO BARROS ROCHA,LUCIANO ROCHA,M,11/02/1968,Válido,43
43444,3194,Eleito,MARCUS ANTONIO DE SOUZA BRITO JUNIOR,MARCUS BRITO JR,M,15/11/1984,Válido,43
43004,46,Suplente,MOACIR DA SILVA AIRES,MOACIR AIRES,M,30/01/1962,Válido,43
43026,190,Suplente,JONILSON VIANA,TITO RELOJOEIRO,M,05/02/1968,Válido,43
43008,21,Suplente,GERSON SILVA RABELO,RABELO,M,30/03/1959,Válido,43
43003,65,Suplente,JANINE AUXILIADORA DA CONCEIÇÃO,JANINE LEVY,F,20/05/1977,Válido,43
43007,43,Suplente,WILCLEIA MOREIRA,DIVA PROTETORA DOS ANIMAIS,F,14/12/1985,Válido,43
43111,30,Suplente,ZILDA FERREIRA GUIMARÃES,ZILDA GUIMARÃES,F,04/02/1963,Válido,43
43210,698,Suplente,JANIO FLAVIO DE AMORIM,JANIO AMORIM,M,26/03/1981,Válido,43
43033,143,Suplente,GETULIO MUNIZ PORTO,GETULIO MUNIZ,M,31/10/1950,Válido,43
43333,87,Suplente,EDILSON ROBERTO MENDES DA ROSA,EDILSON ROSA,M,10/10/1963,Válido,43
43665,774,Suplente,SIDNEY DE SOUZA,SIDNEY DE SOUZA,M,31/10/1977,Válido,43
43555,283,Suplente,MARIA EDUARDA DE FRANÇA MOLINA,MARIA MOLINA,F,19/05/2001,Válido,43
43443,813,Suplente,OZIANE ALVES RODRIGUES MARTINS,OZIANE RODRIGUES JORNALISTA,F,21/04/1987,Válido,43
43222,629,Suplente,UGOLINA CEZARIA DA CRUZ,UGA CRUZ,F,01/04/1963,Válido,43
43192,201,Suplente,IVONE MARIA DA SILVA PORTUGAL,IVONE PORTUGAL,F,13/01/1970,Válido,43
43800,604,Suplente,RONALD MUZZI NETO,RONALD MUZZI,M,28/06/1968,Válido,43
43344,155,Não eleito,EDSON DA SILVA PIRES,EDSON PIRES BRASIL,M,19/08/1972,Anulado,43
43777,814,Suplente,ONOFRE DE FREITAS JUNIOR,ONOFRE JUNIOR,M,18/05/1966,Válido,43
43321,58,Suplente,HERMES PAIVA SERRA,HERMES SERRA SERRA,M,08/05/1962,Válido,43
43123,2434,Eleito,MARIO ANTONIO MOYSES NADAF,MARIO NADAF,M,23/02/1966,Válido,43
43999,1884,Eleito,PAULO HENRIQUE DE FIGUEIREDO,PAULO HENRIQUE,M,08/03/1968,Válido,43
43556,969,Suplente,MARCOS PAULO SERRA DA SILVA,MARQUINHOS CARIOCA,M,05/01/1975,Válido,43
43023,222,Suplente,LUCAS JOSÉ MOREIRA MOTA,LUCAS MOTA,M,28/08/1986,Válido,43
43200,1762,Suplente,ZIDIEL INFANTINO COUTINHO JUNIOR,ZIDIEL COUTINHO,M,28/01/1979,Válido,43
43223,525,Suplente,GILSON PEREIRA BATISTA,GILSON BATISTA,M,26/05/1970,Válido,43
43090,71,Suplente,MIRIAM DE OLIVEIRA,MIRIAM DO PEDRA NOVENTA,F,18/02/1971,Válido,43
43457,34,Suplente,VERA LUCIA MAGALHÃES SILVA,LUCIA MAG,F,25/04/1956,Válido,43
45451,35,Suplente,EDIANA FERREIRA DE CAMPOS,EDIANA FERREIRA,F,26/05/1974,Válido,45
45455,18,Suplente,AMANDA RAFAELA GOMES DA SILVA,AMANDA MANTOVANI,F,21/12/1988,Válido,45
45783,158,Suplente,ODENIR NILO DA SILVA,NICA,M,26/09/1971,Válido,45
45500,1307,Suplente,MARIA DO CARMO MOREIRA OLIVEIRA AVALONE,MARIA AVALONE,F,16/07/1958,Válido,45
45333,97,Suplente,VINICIUS DE PAULA MOREIRA,VINICIUS MOREIRA,M,14/11/1977,Válido,45
45105,164,Suplente,ERASMO CARLOS DA COSTA,CARLOS MENEGATTI,M,20/08/1973,Válido,45
45222,19,Suplente,RUBSNEI BUENO GALVARRO,ROBINHO BUENO,M,03/06/1980,Válido,45
45123,208,Suplente,RONAN KAYQUE DE SOUZA ALVES,RONAN ALVES,M,27/11/1995,Válido,45
45345,32,Suplente,AUGUSTO FERREIRA DA SILVA,GUGU,M,03/04/1960,Válido,45
45228,92,Suplente,SUILENE RAMOS DE MAGALHAES,SUILENE MAGALHÃES,F,30/05/1976,Válido,45
45100,1605,Suplente,RICARDO SAAD,DR RICARDO SAAD,M,23/09/1949,Válido,45
45865,33,Suplente,EDINETH SEBASTIANA DOS SANTOS,EDINETH,F,17/01/1967,Válido,45
45431,42,Suplente,HILDA CORREA GOMES DE ARRUDA,HILDA,F,10/05/1958,Válido,45
45000,87,Suplente,DOMINGOS SOARES DA SILVA,FUMAÇA SOARES,M,09/09/1969,Válido,45
45040,80,Suplente,MESSIAS DO BOM DESPACHO DE BARROS,MESSIAS,M,08/05/1965,Válido,45
45889,7,Suplente,LEIVA MARIA LOPES,LEIVA LELE,F,11/07/1972,Válido,45
45145,24,Suplente,CREUZA MARCIA DE OLIVEIRA VIANA,CREUZA MARCIA,F,21/01/1972,Válido,45
45555,885,Suplente,ANTONIO FERREIRA DE SOUZA,TONINHO DE SOUZA,M,10/08/1966,Válido,45
45045,2606,Eleito,RENIVALDO ALVES DO NASCIMENTO,RENIVALDO NASCIMENTO,M,07/10/1961,Válido,45
45600,46,Suplente,GILBERTO RODRIGUES TEIXEIRA,BETINHO,M,19/06/1965,Válido,45
45101,71,Suplente,JAMIL DE PAULA RAMOS,PROFESSOR JAMIL,M,13/05/1942,Válido,45
29029,32,Não eleito,ANDRÉ ELIAS CRUZ ANTUNES,ANDRÉ ELIAS ANTUNES,M,06/05/1992,Válido,29
19400,93,Suplente,MAICON APARECIDO DA SILVA,MAICON APARECIDO,M,11/06/1980,Válido,19
19555,445,Suplente,TIAGO SALES DE ALMEIDA,GATO LOUCO,M,11/05/1988,Válido,19
19220,386,Suplente,JOSÉ MENEZES SIQUEIRA,MENEZES DA FARMÁCIA,M,11/05/1963,Válido,19
19007,409,Suplente,MARCIONE MENDES DE PINHO,MARCIONE,M,13/02/1977,Válido,19
19991,260,Suplente,FLÁVIO MESQUITA MUNHOZ DA SILVA,KIKO DOS GUERREIROS,M,09/09/1982,Válido,19
19190,302,Suplente,CÉLIA REGINA SILVA PAIXÃO,CÉLINHA PAIXÃO,F,30/05/1962,Válido,19
19002,230,Suplente,TERMA MARIA DE MORAES SILVA DELGADO,TELMA DELGADO,F,31/05/1972,Válido,19
19456,390,Suplente,CARLOS FRANCISCO RODRIGUES DA COSTA,PROF: CARLINHOS,M,10/09/1980,Válido,19
19700,107,Suplente,JOZAN DIEGO NUNES APRINIO ROCHA,DIEGO ROCHA,M,07/12/1991,Válido,19
19333,598,Suplente,JOSÉ CARLOS DA SILVA,ZÉ CARLOS RENASCER,M,16/11/1964,Válido,19
19789,203,Suplente,ALESSANDRO RAMOS,ALESSANDRO RAMOS,M,27/03/1979,Válido,19
19321,564,Suplente,CREMARIO DE SOUZA BENEVIDES,MÁRIO BENEVIDES,M,05/11/1980,Válido,19
19123,3052,Eleito,DILEMÁRIO DO VALE ALENCAR,DILEMÁRIO ALENCAR,M,07/11/1966,Válido,19
19000,179,Suplente,MARIA JOSÉ DE OLIVEIRA ARRUDA,PROFESSORA MAZÉ,F,22/04/1967,Válido,19
19319,90,Suplente,NERES ALVES DAS NEVES JÚNIOR,NERES DO CT,M,12/09/1973,Válido,19
19800,1794,Eleito,WILSON NONATO SILVA,WILSON KERO KERO,M,27/11/1970,Válido,19
19111,1074,Suplente,NILSON PORTELA FERREIRA,NILSON PORTELA,M,17/12/1975,Válido,19
19244,44,Suplente,JOSÉ CORREA DE MIRANDA,JOSÉ MIRANDA,M,05/01/1979,Válido,19
19199,67,Suplente,RODRIGO DE SANTA ANA,RODRIGO SANT'ANA,M,25/09/1986,Válido,19
19888,325,Suplente,VALDIR VIEIRA PEREIRA,PROF. VALDIR PEREIRA,M,30/07/1977,Válido,19
19011,1074,Suplente,RENATO DA SILVA MOTA,RENATO MOTA,M,10/02/1972,Válido,19
19444,110,Suplente,MARIA FRANCISCA SILVA,BIA CALMON,F,02/08/1952,Válido,19
19100,63,Suplente,RAQUEL GONÇALVES DA SILVA BENETOLI,RAQUEL DO QUILOMBO,F,21/04/1974,Válido,19
19191,130,Suplente,EDIANA TANARA DE OLIVEIRA,EDIANA THANARA,F,15/08/1988,Válido,19
19300,323,Suplente,JAMAIRA MANUELI PROENÇA AMORIM,JAMAIRA PROENÇA,F,12/07/1976,Válido,19
19777,82,Suplente,ADAMARA NASCIMENTO BUENO SAN MARTIN,ADAMARA SAN MARTIN,F,23/10/1993,Válido,19
19019,207,Suplente,ANDERSON AMARAL ROSA,ANDERSON AMARAL,M,05/03/1980,Válido,19
19009,364,Suplente,KERLE SANTANA DA SILVA,KERLE SANTANA,F,22/05/1980,Válido,19
19222,85,Suplente,RODRIGO BRUEL GUIRELLI,RODRIGO BRUEL,M,27/02/1981,Válido,19
19038,1590,Suplente,RAFAEL BEAL RANALLI,POLICIALFEDERAL RAFAEL RANALLI,M,04/07/1979,Válido,19
19999,288,Suplente,ROSANGELA MARQUES DA SILVA ALMEIDA,ROSANGELA ALMEIDA,F,17/07/1981,Válido,19
19500,130,Suplente,IVAN DOS SANTOS SILVA,IVAN SANTOS,M,27/09/1988,Válido,19
19900,332,Suplente,HELDER FALCÃO DE ARRUDA,HELDER FALCÃO,M,02/03/1988,Válido,19
19453,629,Suplente,LEOVALDO CASTRO DE CAMPOS,VADINHO,M,18/06/1980,Válido,19
19171,104,Suplente,CLÁUDIA AVELINO NÓIA,CLÁUDIA NÓIA,F,07/08/1976,Válido,19
19322,57,Suplente,EDUARDO FRANCISCO DA SILVA,EDUARDO BRAGA,M,02/11/1986,Válido,19
18051,77,Não eleito,JOSE DO CARMO DE MORAES ARRUDA,PANTANEIRO SANGUE AZUL,M,21/02/1976,Válido,18
18100,45,Não eleito,HEBER JORGE DE FARIAS,PROF. JORGE FARIAS,M,13/05/1968,Válido,18
18348,61,Não eleito,MAURO FERREIRA DOS SANTOS,MAURO MARCENEIRO,M,30/03/1976,Válido,18
18111,135,Não eleito,ANDRÉA PAULA DE ALENCAR ZANCO,ANDRÉA ZANCO,F,29/09/1979,Válido,18
18223,18,Não eleito,GISELE DOS SANTOS BARBOSA,GISELE BARBOSA,F,23/04/1972,Válido,18
18018,23,Não eleito,ALMIR SEBASTIAO RIBEIRO DE SOUZA,ALMIR ARQUITETO,M,21/01/1980,Válido,18
18931,112,Não eleito,ADILSON DAMIÃO DA SILVA CRUZ,ADILSON CRUZ,M,25/09/1974,Válido,18
18123,122,Não eleito,LAILA GRAZIELA OLIVEIRA DUTRA,LAILA DUTRA,F,04/01/1982,Válido,18
18316,241,Não eleito,GILVAN BISPO SANTIAGO,GILVAN BISPO,M,30/12/1963,Válido,18
18888,81,Não eleito,WANIA GRÁCIA AMORIM LIMA,WANIA AMORIM,F,11/11/1961,Válido,18
51444,322,Suplente,ROBERTO OLIVEIRA LUCIALDO,ROBERTO LUCIALDO,M,23/02/1953,Válido,51
51007,293,Suplente,EDINEI APARECIDO PEREIRA DA SILVA,EDINEI NINHA,M,25/10/1969,Válido,51
51135,69,Suplente,DAMIANE LIMA DE BARROS,DAMIANE LIMA,F,16/04/1981,Válido,51
51143,693,Suplente,REGINALDO FERREIRA DE ANDRADE,REGINALDO ANDRADE,M,14/07/1980,Válido,51
51051,301,Suplente,ETERNO LEIDE MONTALVAO,ETERNO MONTALVÃO,M,10/04/1965,Válido,51
51000,975,Suplente,OSCEMARIO FORTE DALTRO,OSCEMÁRIO DALTRO,M,10/03/1963,Válido,51
51222,1006,Suplente,PABLO RODRIGO QUEIROZ,PABLO QUEIROZ,M,05/05/1981,Válido,51
51888,83,Suplente,ELDA MOURA SANTOS,ELDA MOURA,F,08/12/1969,Válido,51
51020,701,Suplente,VILMA PAULA BARROS DE ASSIS,VILMA BARROS,F,24/08/1970,Válido,51
51138,589,Suplente,CICERO ANTONIO,MAJOR CICERO,M,28/08/1963,Válido,51
51667,5,Suplente,LUCILENE APARECIDA CUSTODIO MARTINS,LUCILENE MARTINS,F,01/07/1976,Válido,51
51788,375,Suplente,TANIA MENDES SANTIAGO,TANIA MENDES,F,17/11/1975,Válido,51
51053,141,Suplente,ENILSON BARBOSA DE OLIVEIRA,NILSON TONINHO DAS FEIRAS,M,19/01/1968,Válido,51
51661,980,Suplente,OSVALDO DE SOUZA BRITO,OSVALDO BRITO,M,05/08/1985,Válido,51
51777,673,Suplente,EDMILSON DA COSTA CARMO,EDMILSON CARMO,M,24/04/1983,Válido,51
51345,238,Suplente,ZENILDO DA CRUZ DE JESUS,ZENILDO CRUZ ZÉ BOI,M,22/10/1973,Válido,51
51500,104,Suplente,UEKSON BRONSON DE ARRUDA,UEKSON BRONSON,M,05/09/1989,Válido,51
51111,519,Suplente,GABRIEL GONCALVES DE MIRANDA,GABRIEL CHAVEIRO,M,24/05/1976,Válido,51
51987,17,Suplente,BRUNO RAFAEL ALVES DA SILVA,BRUNO ALVES,M,06/04/1997,Válido,51
51456,1488,Eleito,KASSIO EDUARDO DA SILVA COELHO,KASSIO COELHO,M,08/11/1979,Válido,51
51100,104,Suplente,EVA INEZ MAGALHAES LEITE SIQUEIRA,EVA LEITE,F,21/01/1973,Válido,51
51031,53,Suplente,MARIA APARECIDA DA SILVA SANTANA,CIDA SANTANA,F,20/11/1976,Válido,51
51200,14,Suplente,LIDIANA FERNANDA RAMOS ARGUELHO,LIDIANA FERNANDA,F,20/11/1991,Válido,51
51190,87,Suplente,WALTER ARRUDA DA SILVA,WALTER ARRUDA DA SILVA,M,17/04/1970,Válido,51
51333,147,Suplente,SEBASTIAO FRANCISCO DA CRUZ,TIÃOZINHO,M,12/12/1960,Válido,51
51077,708,Suplente,RAFAEL DA SILVA YONEKUBO,RAFAEL YONEKUBO,M,01/04/1980,Válido,51
51010,14,Suplente,SEULINE ASSUNCAO SOUZA DOMINGUES DA SILVA,PROFESSORA SEULINE,F,22/02/1988,Válido,51
51357,218,Suplente,WILDES TADEU DE CARVALHO,WILDES TADEU,M,04/08/1962,Válido,51
