numero,votos_nominais,situacao,nome,nome_urna,sexo,data_nasc,destino_voto,numero_partido
12014,94,,JAIR AQUINO DE LIMA,JAIR AQUINO,M,14/04/1968,Válido,12
12888,127,,JOÃO PAULO MARINHO FERREIRA,PAULO FERREIRA,M,11/06/1999,Válido,12
12010,294,,VICTOR GAMA DA ROCHA MATOS,VICTOR GAMA,M,16/03/1999,Válido,12
12777,158,,ALCENIR SEIXAS DOS SANTOS,CHEFE ALCENIR,M,23/11/1977,Válido,12
12012,96,,JEFFERSON ALEXANDRE DOS REIS,JEFFERSON ALEXANDRE,M,21/09/1979,Válido,12
12137,0,,PRISCILA LIMA MENEZES,PRISCILA LIMA,F,16/09/1981,Válido,12
23456,3237,,WILLIAM ROBERT LAUSCHNER,WILLIAM ALEMÃO,M,20/08/1977,Válido,23
23100,433,,RONNI DA SILVA FERNANDES,RONNI FERNANDES,M,09/05/1980,Válido,23
23190,1373,,WALTER RODRIGUES DA CRUZ JUNIOR,CORONEL WALTER CRUZ,M,01/01/1968,Válido,23
23323,1457,,ROGERIO DE AGUIAR DA COSTA,ROGERIO AGUIAR,M,29/06/1988,Válido,23
23234,84,,ARIDINEI OLIVEIRA DE CASTRO CARNEIRO,ARIDINEI CARNEIRO,M,20/10/1967,Válido,23
23345,269,,WILLIAM LIMA DA CUNHA,CHOPINHO,M,16/08/1970,Válido,23
23963,143,,MANOEL TONY BRASIL DOS SANTOS,TONY BRASIL,M,06/01/1987,Válido,23
23012,169,,GISELE VILALBA ISHIKAWA,BISPA GISELE ISHIKAWA,F,19/02/1971,Válido,23
23000,2885,,MARIVALDO DE ANDRADE AGOSTINHO,MARIVALDO,M,25/05/1969,Válido,23
23600,289,,MARCINEIDE SANTOS ALVES,MARCIA ALVES,F,04/01/1988,Anulado sub judice,23
23444,630,,MARCIO MARQUEZ DA SILVA,PROF. MARCIO,M,09/06/1978,Anulado,23
23656,222,,LARYSSA DA COSTA MOURA,LARYSSA MOURA,F,04/12/1996,Válido,23
23567,1,,EUGENIA SIMONE FERREIRA RODRIGUES,EUGENIA RODRIGUES,F,19/08/1979,Válido,23
23002,26,,KATIA CILENE DA SILVA PACHECO,KATIA PACHECO,F,29/04/1974,Válido,23
23223,241,,MONICA DE MELO COSTA FIGUEIREDO,MONICA FIGUEIREDO,F,09/10/1978,Válido,23
23787,22,,JOSE ANDRE LUIZ BARROS BABILÔNIA,ANDRE BABILÔNIA,M,09/04/1976,Válido,23
23900,232,,ELIANE MARIA MAGALHÃES PONTES,SARGENTO ELIANE PONTES,F,30/07/1972,Válido,23
23200,299,,CLAUDEMARA ALBANO GUIMARÃES,CLAUDEMARA GUIMARÃES,F,14/11/1968,Válido,23
23565,51,,MARIA DE JESUS PONTES DA SILVA,MARI PONTES,F,07/11/1962,Válido,23
23023,1375,,JOSE LUIZ DE SOUZA SERRÃO,SOLDADO DA TORRE,M,23/10/1971,Válido,23
23301,39,,ERIMILSON VALENTE ALVES,CARECA BELLO,M,15/02/1973,Válido,23
23007,115,,HEARLEN MOREIRA DE SOUZA,SARGENTO HEARLEN,M,21/03/1983,Válido,23
23001,69,,RAIMUNDO SILVANO FRAZÃO,SILVANO FRAZÃO,M,12/02/1966,Válido,23
23888,160,,FIDEL DOS SANTOS NOBRE,APOSTOLO FIDEL,M,20/10/1983,Válido,23
23500,212,,ERCULES BARROS DE QUEIROZ,PERNINHA DO GÁS,M,18/09/1977,Válido,23
23111,811,,JOELMA BORGES SOARES,JOELMA SOARES,F,27/10/1983,Anulado sub judice,23
23123,1161,,ELCY MONTEIRO BARROSO JUNIOR,ELCY JUNIOR,M,25/09/1974,Válido,23
23986,457,,ADRIANO DA SILVA GOMES,ADRIANO BAHIA,M,09/09/1986,Válido,23
23789,1615,,HELIO AUGUSTO LEMOS DE OLIVEIRA,HELINHO,M,31/10/1977,Válido,23
23003,209,,MARIA IZETE QUEIROZ DA SILVA,SARGENTA IZETE,F,20/06/1971,Anulado sub judice,23
23410,109,,FLAVIO JUNIOR BRITO DOS SANTOS,PROF. FLAVIO SANTOS,M,27/02/1982,Válido,23
23654,192,,MAGALI BEZERRA DA SILVA NASCIMENTO,MAGALI NASCIMENTO,F,19/07/1965,Válido,23
23232,163,,SANDRO CARLOS DAS CHAGAS SILVA,PROFESSOR SANDRO SILVA,M,01/05/1975,Válido,23
23555,1973,,TARCISIO NUNES DE LIMA,TARCISIO LIMA,M,05/09/1972,Válido,23
23300,1295,,JOSIMAR GADELHA DE MELO,JOSIMAR GADELHA,M,13/08/1986,Válido,23
23777,2865,,MARCELO MACHADO DIAS,DELEGADO MARCELO DIAS,M,22/04/1973,Válido,23
23999,171,,ISAQUE BARBOSA DE FREITAS,ISAQUE FREITAS,M,10/11/1990,Válido,23
23333,2955,,SERGIO CARDOSO EMILIANO,SERGINHO CARDOSO,M,09/02/1983,Válido,23
23321,2623,,JANDER KLAY LIMA DE CARVALHO,JANDER LIMA,M,31/10/1983,Válido,23
23455,171,,ENIVALDO COSTA DOS SANTOS,DUNGA SANTOS,M,31/08/1969,Válido,23
23222,1864,,FRANCISCO WALLACE DANTAS DA SILVA,WALLACE DANTAS,M,02/06/1972,Válido,23
23213,969,,RIGOR BRENO MARANHÃO DA SILVA,RIGOR BRENO,M,26/03/1990,Válido,23
23433,32,,FERNANDO HENRIQUE DOS SANTOS ALZIER,FERNANDO OLHÃO,M,20/05/1981,Válido,23
23101,108,,KENNEDY LUIS VIEIRA DA SILVA,KENNEDY PINTA CUIA,M,28/11/1968,Válido,23
23231,58,,ISABEL CRISTINA DA SILVA LIMA,CRISTINA DO PARQUE SÃO PEDRO,F,10/06/1978,Válido,23
25300,145,,MARIA DO SOCORRO DE FREITAS SOARES,SOCORRO FREITAS,F,04/01/1964,Válido,25
25222,4714,,GILMAR DE OLIVEIRA NASCIMENTO,GILMAR NASCIMENTO,M,16/12/1962,Válido,25
25235,67,,ALEXANDRE DELFINO GOMES,ALEXANDRE GOMES,M,11/08/1981,Válido,25
25133,200,,GERSINHO DOS SANTOS PINHEIRO COLARES,GERSON DO CENTRO,M,24/03/1970,Válido,25
25146,14,,ANTÔNIO FRANCISCO DA COSTA,ANTONIO COSTA,M,13/06/1951,Válido,25
25150,392,,FERNANDO ALMEIDA MARQUES,FERNANDO MARQUES,M,26/06/1971,Válido,25
25777,1645,,LEOCÁDIO LOPES,LEOCADIO LOPES,M,24/08/1980,Válido,25
25890,119,,HILTON LOPES DA COSTA,HILTON LANCHE,M,21/12/1972,Válido,25
25678,282,,REINALDO BRANDÃO DA COSTA,NALDO COSTA,M,06/01/1976,Válido,25
25055,190,,MÔNICA GOMES DA SILVA PITANGA,ENF MONICA,F,19/04/1967,Válido,25
25799,327,,WILSON RICARDO DE MORAES FRANCO,RICARDO FRANÇA,M,08/11/1966,Válido,25
25225,282,,KARLA DANIELLE OLAVO RODRIGUES,PROFESSORA KARLA RODRIGUES,F,21/02/1986,Válido,25
25252,32,,FABIOLA DA SILVA SOUZA,FABIOLA DA ZUMBA,F,03/04/1983,Válido,25
25525,248,,JOSÉ AMÉRICO LUCENA BARROS,JOSE AMERICO,M,25/05/1960,Válido,25
25800,43,,FÁBIO MARINHO DA SILVA,FABIO SILVA,M,29/11/1980,Válido,25
25255,82,,MARIA ZULEIDE GOMES DE SOUZA,ZULEIDE SOUZA,F,11/07/1970,Válido,25
25555,1268,,JANAÍNA MORAES MEDEIROS DOS SANTOS,JANAINA MORAES,F,12/12/1981,Válido,25
25325,147,,FRANCISCO LOPES DA SILVA,PROF FRANCISCO LOPES,M,09/05/1949,Válido,25
25500,41,,MARCOS SILVA DE SOUZA,MARCOS SILVA,M,09/01/1981,Válido,25
25670,83,,JOSIMAR CARVALHO DA SILVA,JOSIMAR SILVA JOJO DO TACACA,M,12/11/1991,Válido,25
25654,169,,RODOLFO CÉLIO BRAGA LIRA,RODOLFO BAGUDA,M,17/11/1975,Válido,25
25123,3023,,EWERTON CAMPOS WANDERLEY,DR EWERTON WANDERLEY,M,25/09/1972,Válido,25
25250,703,,JAMES LUCE CASTRO DE ARAÚJO,JAMES ARAUJO,M,19/11/1973,Válido,25
25333,2261,,MARIA DO PERPETUO SOCORRO DUARTE DA SILVA FREITAS,PROF SOCORRO DUARTE,F,14/04/1965,Válido,25
25888,413,,REGINA CÉLIA GOMES DA CUNHA,REGINA CELIA,F,07/09/1948,Válido,25
25025,5021,,SANDRO MAIA FREIRE,SANDRO MAIA,M,11/11/1970,Válido,25
25200,266,,MARAMOR JACOB AREIAS LINS,MARAMOR,F,21/03/1970,Válido,25
25131,38,,FERNANDO DIEGO GOES LIMA,DR FERNANDO DIEGO,M,02/01/1982,Válido,25
25666,143,,RAIMUNDO NONATO DE FREITAS SOARES,RAIMUNDO SOARES,M,03/11/1960,Válido,25
25567,733,,MARIO JOSE HENRIQUE DE SOUZA,MARIO JOSE,M,14/01/1962,Válido,25
25789,23,,FERNANDO ALMEIDA DOS SANTOS,DR FERNANDO ALMEIDA,M,09/06/1950,Válido,25
25321,204,,JOBERTISA ROSALIA LYRA ARAUJO,DRA JOBERTISA LYRA,F,07/12/1970,Válido,25
25335,97,,ALISSANDRA CARVALHO DA SILVA,ALISSANDRA CASCAIS,F,26/03/1974,Válido,25
25049,17,,GETÚLIO LEONEL DE OLIVEIRA,GETULIO LEONEL,M,20/04/1954,Válido,25
27270,1234,,THIAGO BOTELHO AVELINO PAES BARRETO PINTO,THIAGO BOTELHO,M,13/01/1987,Válido,27
27258,91,,FRANK CARLOS OLIVEIRA DE SOUZA,PASTOR FRANK CARLOS,M,28/08/1978,Válido,27
27023,397,,KATIA REGINA DE SOUZA VENTURA,KATIA VENTURA,F,23/11/1966,Válido,27
27190,306,,MARIA DO PERPETUO SOCORRO DA ROCHA BRELAZ,PROFA SOCORRO BRELAZ,F,06/07/1969,Válido,27
27192,515,,DENISON DE CARVALHO VILAR,DENISON VILAR DO SAMU,M,25/09/1981,Válido,27
27166,24,,ELOIZA HELENA MOTA DE ARAUJO DE SOUZA,ELOIZA ARAUJO,F,13/06/1966,Válido,27
27150,127,,ALEX DE SOUZA BRANDÃO,PASTOR ALEX BRANDÃO,M,09/02/1981,Válido,27
27722,213,,SANLEY LIMA ALVES,SAM CADEIRANTE,M,22/07/1983,Válido,27
27235,88,,RAQUEL MORAES MACEDO DE SOUZA,RAQUEL MORAES,F,28/11/1978,Válido,27
27234,285,,VALCIMAR NOGUEIRA MACIEL,VALCIMAR MACIEL,M,16/08/1973,Válido,27
27333,844,,ALLAN DA SILVA NASCIMENTO,GARI CANTOR,M,25/01/1979,Válido,27
27789,1092,,TIAGO RODRIGUES NEVES,TIAGO RODRIGUES ZANGADÃO,M,11/09/1989,Válido,27
27369,347,,ROBERVAL LOPES DA SILVA,ROBERVAL DA CIDADE NOVA,M,28/11/1970,Válido,27
27633,210,,JAKERLEY PEREIRA DA SILVA,JAKERLEY,M,10/04/1962,Válido,27
27145,46,,ROSANA PEDRAÇA DA ROCHA,ROSANA PEDRAÇA,F,16/08/1970,Válido,27
27137,21,,IRANI PEREA MERLO,NANI,F,04/12/1961,Válido,27
27456,306,,JOSE CLAUDIO SILVA DE SOUZA,PASTOR CLAUDIO,M,07/08/1973,Válido,27
27320,1422,,RODRIGO SID DE SOUZA,RODRIGO COHEN,M,22/03/1984,Válido,27
27700,368,,AGLEI DUQUES MACIEL JÚNIOR,AGLEI JUNIOR,M,26/12/1985,Válido,27
27027,4621,,RAIFF MATOS SILVA VASCONCELOS,RAIFF MATOS,M,01/10/1980,Válido,27
27111,715,,TIAGO DE AMORIM AYUB,TIAGO AYUB,M,08/06/1987,Válido,27
27127,1223,,TIAGO DOS SANTOS GOMES,TIAGO GOMES,M,01/02/1986,Válido,27
27181,252,,FABIO CAMPELO DOS SANTOS,FABIO SANTOS,M,18/08/1981,Válido,27
27356,197,,SAULO TIAGO CAVALCANTE PEREIRA,SAULO TIAGO,M,04/12/1984,Válido,27
27017,529,,RICARDO DE FREITAS PEREIRA,RICARDO PEREIRA,M,03/11/1978,Válido,27
27147,82,,MARIA NATIVIDADE DA SILVA RODRIGUES,NATI RODRIGUES,F,06/02/1959,Válido,27
27827,266,,MARIA LAURA LEITE LOBATO,MARIA LAURA,F,10/08/1974,Válido,27
27180,46,,JACQUELINE MALDONADO,JACQUELINE MALLDONNADO,F,26/06/1984,Válido,27
27299,203,,HOERLEY DUTRA DE SOUZA,DUTRA,M,29/04/1974,Válido,27
27007,833,,FABIANE ARAUJO DE OLIVEIRA,FABI ARAÚJO,F,07/12/1978,Válido,27
27193,6,,MONICA CAROLINE DE OLIVEIRA LIMA,MONICA CAROLINE,F,22/01/1986,Válido,27
27555,427,,MAURO MAGNO VIEIRA,PR MAURO MAGNO,M,11/01/1963,Válido,27
27300,717,,CLEUDOMAR PEIXOTO MACIEL,PR CLEUDOMAR MACIEL,M,26/03/1979,Válido,27
27968,172,,PAULO SERGIO DE SOUSA GONÇALVES,PAULO GONÇALVES,M,27/09/1968,Válido,27
27038,74,,SHEYLA CANDIDA FERREIRA,SHEYLA BOLSONARO,F,15/10/1971,Válido,27
27223,345,,CLODOALDO PRINTES TRAVASSOS,TINHA,M,05/03/1970,Válido,27
27123,573,,ANTONIO GERALDO SILVA DA ROCHA,GERALDO ROCHA GERA,M,11/02/1957,Válido,27
27444,345,,EDILSON CARVALHO DA GAMA,ALDO DO PIORINI,M,21/08/1971,Válido,27
27000,1065,,MARCOS ANTONIO DO NASCIMENTO PEREIRA,MARCOS DO BARRA VERMELHA,M,06/11/1971,Válido,27
27001,401,,GLEYDE LIMA DA SILVA,GLEYDE SILVA,F,24/10/1975,Válido,27
27535,237,,AGENOR TEIXEIRA MARTINS FILHO,AGENOR MARTINS,M,17/09/1970,Válido,27
27024,914,,DARIVAN VALENTE DE MELO,DARIVAN VALENTE,M,09/11/1970,Válido,27
27600,535,,SILAS RODRIGUES CIDADE,SILAS CIDADE,M,09/06/1986,Válido,27
27727,2157,,SERGIO RAIMUNDO ERNESTO MACHADO,DR SÉRGIO MACHADO,M,08/09/1966,Válido,27
27102,11,,ANDREIA MARIA CORRÊA DE SOUZA,ANDREIA MARIA,F,13/11/1975,Válido,27
27999,4,,MARCIO COUTINHO SAMPAIO,DOM SAMPAIO,M,25/11/1983,Válido,27
27222,568,,CELSO CORSINO DA SILVA,CELSO CORSINO,M,10/08/1970,Válido,27
27777,2770,,STONES DA COSTA MACHADO,STONES MACHADO,M,15/05/1955,Válido,27
27221,20,,SIDINA SOCORRO DOS SANTOS OLIVEIRA,SOCORRO OLIVEIRA,F,23/06/1967,Válido,27
27500,466,,SERGIO AUGUSTO COELHO BEZERRA,PROFESSOR SERGIO BEZERRA,M,06/08/1972,Válido,27
27077,94,,FRANCISCO MARCOS SOUZA DA SILVA,MARCOS,M,17/08/1989,Válido,27
27277,20,,DEBORA COSTA MIRANDA,DEBORA MIRANDA,F,08/11/1977,Válido,27
27380,562,,NERO MARINHO DOS SANTOS,CEL PM NERO,M,04/02/1971,Válido,27
27002,111,,MARIA LOPES RIBEIRO,MARIA PAIXÃO,F,08/05/1977,Válido,27
27040,657,,RAIMUNDO CLEUCI ROBERTO DE CASTRO,PROF. RAIMUNDO CLEUCI,M,30/10/1967,Válido,27
27121,347,,ODAZIR DA COSTA GUIMARÃES,PR ODAZIR GUIMARÃES,M,22/03/1966,Válido,27
27100,2798,,ISAAC TAYAH,DR ISAAC TAYAH,M,08/10/1963,Válido,27
27321,225,,CLAUDE DOUGLAS LIMA DE MORAES,CLAUDE DOUGLAS,M,04/02/1973,Válido,27
27888,964,,LOUSE RIGER MENDONCA REBELO,LOUSE RIGER,F,10/02/1990,Válido,27
70888,787,,ANDRE RICARDO DE ARAUJO SANTIAGO,ANDRE SANTIAGO,M,30/03/1980,Válido,70
70321,309,,HERCULES DANTAS SOEIRO,TENENTE DANTAS,M,17/12/1966,Válido,70
70349,991,,LOURISVAL PEREIRA DA CONCEICAO,LOURISVAL PEREIRA,M,23/07/1976,Válido,70
70192,1209,,JOSE DA SILVA MENDES,BOMBEIRO MENDES,M,03/10/1968,Válido,70
70044,683,,MARIA DE JESUS ATANASIO DA SILVA,PROFESSORA JESUS,F,24/12/1965,Válido,70
70169,106,,SEBASTIAO CARLOS FONSECA FARIAS,ENFERMEIRO SEBASTIAO CARLOS,M,14/09/1969,Válido,70
70600,926,,ISIDORIO LIMA ALFAIA,PASTOR ALFAIA,M,11/04/1979,Válido,70
70258,940,,MARCELL ALLYSON DE SOUZA MOTA,JORNALISTA MARCELL MOTA,M,24/07/1981,Válido,70
70770,4189,,RODINEI MOURA RAMOS,RODINEI RAMOS,M,28/10/1977,Anulado sub judice,70
70111,4801,,LISSANDRO BREVAL SANTIAGO,LISSANDRO BREVAL,M,18/08/1977,Válido,70
70155,31,,REINALDO RODRIGUES DE LIMA,REINALDO LIMA,M,01/03/1983,Válido,70
70234,5087,,MANOEL EDUARDO DOS SANTOS ASSIS,DR EDUARDO ASSIS,M,06/07/1981,Válido,70
70707,2284,,VALQUINDAR FERREIRA MAR JUNIOR,PROFESSOR JUNIOR MAR,M,08/01/1986,Válido,70
70356,18,,RENATA CORREA MARINHO,BONITA DO VIVER MELHOR,F,22/12/1978,Válido,70
70900,486,,ORENI CAMPELO BRAGA DA SILVA,ORENI BRAGA,F,13/08/1963,Válido,70
70870,1828,,WILLACE OLIVEIRA DE SOUZA,WILLACE SOUZA,M,06/10/1994,Válido,70
70007,1509,,JAIRO RIBEIRO DIAS,JAIRO DA VICAL,M,14/10/1970,Válido,70
70092,833,,RONALDO BARRETO ANTONY,RONALDO BARRETO,M,10/04/1977,Válido,70
70444,1633,,ADINAMAR BENTO MACEDO,ISRAEL ADINAMAR,M,31/12/1977,Válido,70
70012,1312,,JAIRO PEREIRA DOS SANTOS,JAIRO SANTOS,M,03/07/1972,Válido,70
70077,1094,,ANA PAULA MACHADO ANDRADE DE AGUIAR,ANA PAULA AGUIAR,F,18/11/1977,Válido,70
70670,1909,,ISAAC REIS DE BARROS,ISAAC REIS,M,19/08/1963,Válido,70
70456,5106,,WANDERLEY CALDEIRA MONTEIRO,WANDERLEY MONTEIRO,M,14/10/1992,Válido,70
70270,300,,KATIANE GAMA FEITOZA,KATY FEITOZA,F,22/05/1984,Válido,70
70700,1640,,GUSTAVO ADOLFO IGREJAS FILGUEIRAS,GUSTAVO IGREJAS,M,22/10/1969,Válido,70
70570,125,,TEREZINHA DE NAZARE DA SILVA BARRETO,TEREZA BARRETO,F,16/10/1964,Válido,70
70555,3916,,VARLENE PEIXOTO GONCALVES,VARLENE GONCALVES,F,09/04/1967,Válido,70
70300,338,,ORNILDA DE OLIVEIRA MINEIRO,ORNILDA MINEIRO,F,18/02/1959,Válido,70
70775,649,,MANOEL ADEMAR PINHEIRO BRITO,MAZINHO DA CARBRAS,M,03/08/1970,Válido,70
70215,644,,BENAE PEREIRA LIMOEIRO,BENAE LIMOEIRO,F,31/07/1980,Válido,70
70400,336,,ANTONIO ADEMIR STROSKI,STROSKI,M,05/11/1958,Válido,70
70220,1435,,EMERSON PERKINS LEMOS DE ASSIS,EMERSON ASSIS,M,06/01/1973,Válido,70
70190,957,,VALCI SILVA SERPA,TENENTE SERPA,M,10/01/1971,Válido,70
70767,616,,ITAMAR FEITOSA DA SILVA,ITAMAR FEITOSA,M,07/04/1967,Válido,70
70133,240,,MILENE SOUZA DE LIMA,MILENE SOUZA,F,07/07/1973,Válido,70
70100,3018,,MAURO GOMES DE SOUZA,MAURO ANIMALESCO,M,28/12/1964,Válido,70
70020,342,,INGRID ALVES DE MENDONCA DE OLIVEIRA,INGRID MENDONCA,F,22/10/1994,Válido,70
70121,1341,,ELIANA NASCIMENTO DE SOUZA GUEDES,MERENDEIRA ELIANA GUEDES,F,05/10/1976,Válido,70
70789,435,,FABIO ARAUJO DO NASCIMENTO,FABIO NASCIMENTO,M,18/05/1980,Válido,70
70999,1137,,EDINETH RAYANA RODRIGUES PINHO,RAYANA PINHO DO BAZAR,F,07/11/1991,Válido,70
70112,434,,JEDRAEL VERISSIMO DA SILVA,PASTOR JEDRAEL,M,10/10/1980,Válido,70
70654,697,,CHEINE ARAUJO PEREIRA,CHEINE ARAUJO,M,20/09/1978,Válido,70
70987,426,,CLEONICE FEITOSA PEREIRA,DONA CLEO,F,12/05/1953,Válido,70
70333,1205,,WILL ROBSON FONTES GOIABEIRA,ROBSON GOIABEIRA,M,02/12/1982,Válido,70
70123,5148,,DAVID VALENTE REIS,DAVID REIS,M,09/06/1978,Válido,70
70070,3965,,CARLOS ALBERTO BRITO DAVILA,PAI AMADO,M,02/11/1979,Válido,70
70000,4566,,ALONSO OLIVEIRA DE SOUZA,ALONSO OLIVEIRA,M,28/11/1961,Válido,70
70550,183,,SUZANA FARIAS BARRETO,SUZANA BARRETO,F,06/05/1968,Válido,70
70377,152,,ERIVAN GOMES CABRAL,ERIVAN CABRAL,M,31/07/1969,Válido,70
70370,66,,JOSE ERALDO AMORIM MUNIZ,ERALDO MUNIZ,M,18/08/1963,Válido,70
70222,1278,,JUCINARA OLIVEIRA DA SILVA RODRIGUES,ENFERMEIRA JUCINARA,F,19/03/1969,Válido,70
70140,614,,JOAO CLAUDIO NOBRE DA SILVA,JC NOBRE,M,15/03/1979,Válido,70
70470,6,,SUELEN VAN ZELLER ALBUQUERQUE SANTOS,SUELEN SANTOS,F,05/12/1981,Válido,70
70477,2379,,RONALDO BARROSO TABOSA DOS REIS,RONALDO TABOSA,M,22/05/1967,Válido,70
70777,1215,,GLAUBER MARCOS CAVALCANTE DUARTE,MARCOS CAVALCANTE,M,01/09/1978,Válido,70
70800,1705,,WILLIAMS DOS SANTOS VIANA,WILLIAMS VIANA,M,15/11/1976,Válido,70
70193,355,,ROBSON DE OLIVEIRA FALCAO CESAR,MAJOR FALCAO,M,08/11/1974,Válido,70
70200,658,,PRISCILA DAYANE SOUSA DA SILVA,PRISCILA DA ACASOTA,F,03/01/1990,Válido,70
70088,1843,,WEINER COELHO BARBOSA,WEINER BARBOSA,M,19/03/1979,Válido,70
70122,1005,,DENIS ALMEIDA DOS SANTOS,DR DENIS,M,19/12/1968,Válido,70
70500,899,,ANA MARIA NASCIMENTO DE OLIVEIRA,ANINHA NASCIMENTO,F,14/04/1956,Válido,70
20010,1564,,MAURO SERGIO DE ALMEIDA BRAGA,MAURO MOTO TÁXI,M,29/04/1973,Válido,20
20456,1130,,ALDRY LESTER XAVIER LAGES,BOB LESTER,M,11/12/1971,Válido,20
20234,2871,,ELIELZA DE LIMA MAIA BASTOS,DRA ELIELZA BASTOS,F,18/05/1973,Válido,20
20448,1853,,MARCOS LIMA DA CUNHA,MARCOS LIMA CONSELHEIRO,M,07/02/1981,Válido,20
20003,2407,,ALVANACY RABELO BARBOSA,VANDA BARBOSA,F,05/12/1961,Válido,20
20005,523,,ELENILSON DO NASCIMENTO OLIVEIRA,ELENILSON OLIVEIRA O DEFENSOR,M,28/06/1980,Válido,20
20711,1766,,GERALDO RIBEIRO DA SILVA JUNIOR,JÚNIOR RIBEIRO,M,30/03/1966,Válido,20
20022,246,,RAIMUNDO ALVES MENDES,BODE CEARÁ,M,25/06/1966,Válido,20
20369,2823,,DAVID FERNANDES DOS SANTOS,DAVID FERNANDES,M,09/06/1985,Válido,20
20126,208,,VALDEMAR ALVES DOS SANTOS,VALDEMAR ALVES,M,30/03/1984,Válido,20
20633,611,,ABEL DE FRANÇA PEDRAÇA FILHO,PASTOR ABEL PEDRAÇA,M,23/04/1958,Válido,20
20890,167,,IOMAR SILVA DO NASCIMENTO,IOMAR NASCIMENTO,M,10/07/1962,Válido,20
20253,136,,DALLAS NEVES MORAES,DALLAS MORAES,F,25/12/1983,Válido,20
20550,726,,MAGNO SANCHO DE FIGUEIREDO,MAGNO SANCHO,M,06/09/1974,Válido,20
20852,87,,SULAMITA SOUZA SILVA TAVARES,SULAMITA,F,30/08/1966,Válido,20
20111,2754,,WANDERSON MENDES FERREIRA,WANDERSON ROBINHO,M,15/12/1990,Válido,20
20077,134,,DENILSON BARBOSA DIAS,GG DA MANGARATAIA,M,22/12/1974,Válido,20
20222,4371,,NATHALIA RACHEL SILVA NASCIMENTO,NATH NASCIMENTO,F,01/04/1988,Válido,20
20120,1059,,JUVENCIO NUNES FILHO,JUVÊNCIO NUNES,M,12/09/1967,Válido,20
20144,458,,GIRLÂNDIA DA SILVA BATISTA,GIRLÂNDIA BATISTA,F,02/10/1976,Válido,20
20000,5031,,DANIEL AMARAL DE VASCONCELOS,DR DANIEL VASCONCELOS,M,26/05/1974,Válido,20
20024,605,,MAURICIO CAVALCANTE COSTA,MAUMAU DO BRAGA MENDES,M,22/04/1988,Válido,20
20676,514,,DAMIANA DE SOUZA COSTA,PROFESSORA DAMIANA,F,29/09/1973,Válido,20
20049,342,,SULLIVAN SANTOS,SULLIVAN DO ALTERNATIVO,M,07/02/1983,Válido,20
20100,487,,MARCOS ANTONIO DE QUEIROZ,PROF MARCOS QUEIROZ,M,14/03/1968,Válido,20
20134,1595,,JOSE LINDOMAR DE SOUZA PAULO,DEDÉ PAULO,M,26/06/1972,Válido,20
20220,12,,JESSICA VANESSA SOUZA DA SILVA,HANNA,F,29/12/1992,Válido,20
20274,367,,IZABEL SANTAREM BARROSO,IZABEL BARROSO,F,07/09/1974,Válido,20
20999,1214,,FRANCISCO ANDERSON ARAUJO DO AMARAL,CHIQUINHO AMARAL,M,23/06/1982,Válido,20
20007,734,,JOAO BATISTA DA COSTA PAULA,JOÃO BITHY,M,05/06/1977,Válido,20
20013,139,,EDILENE COELHO PERES PINTO,ENFERMEIRA EDILENE KOKAMA,F,13/06/1964,Válido,20
20118,213,,FABIA ELANE NASCIMENTO GUIMARAES,FÁBIA GUIMARÃES,F,08/08/1975,Válido,20
20540,1699,,EDILSON DE SOUZA MACEDO,EDILSON RHASILEY,M,31/01/1981,Válido,20
20555,4666,,CAIO ANDRE PINHEIRO DE OLIVEIRA,CAIO ANDRÉ,M,26/05/1979,Válido,20
20444,1931,,JANUARIO FRANCISCO ROCHA,JANUÁRIO ROCHA,M,10/08/1956,Válido,20
20506,2422,,FLAVIO TADEU TOMAS DE ARAUJO,FLAVINHO ARAÚJO,M,25/12/1984,Válido,20
20135,184,,GERSON PESSOA DOS SANTOS,GERSON SANTOS,M,24/12/1964,Válido,20
20008,458,,NARA JOAQUINA MARQUES MENDES,NARA DE TAL,F,11/09/1987,Válido,20
20017,117,,REGINALDO JOSE QUEIROZ DE SOUZA,ENGENHEIRO REGINALDO,M,07/11/1977,Válido,20
20123,2973,,EZEQUIAS NASCIMENTO DOS SANTOS,DR MIKE,M,10/12/1975,Válido,20
20324,1004,,RONALDO ALVES OLIVEIRA,RONALDINHO TARUMÃ,M,09/06/1968,Válido,20
20888,4401,,ALLAN CAMPELO DA SILVA,ALLAN,M,29/04/1971,Válido,20
20009,1641,,JOSE IRAN FIGUEIREDO DE LIMA,IRAN DAS COMUNIDADES,M,01/02/1973,Válido,20
20655,433,,EVANDRO PADILHA BARROSO,DR EVANDRO,M,06/10/1957,Válido,20
20333,1277,,ALBERTO D'ALMEIDA COELHO,ALBERTO D'ALMEIDA,M,03/11/1976,Válido,20
20644,1051,,HUGO LINCOLN DA COSTA BACELAR,HUGO BACELAR,M,29/06/1996,Válido,20
20020,459,,JACQUELINE SIQUEIRA SURIADAKIS,JACQUELINE SURIADAKIS,F,20/12/1980,Válido,20
20629,504,,WENDELL MOREIRA DOS SANTOS,WENDELL SANTOS,M,28/01/1979,Válido,20
20651,2984,,FRANK ABILIO ANDRADE DE SOUZA,PR FRANK ABÍLIO,M,18/10/1975,Válido,20
20789,4885,,RODRIGO GUEDES OLIVEIRA DE ARAUJO,RODRIGO GUEDES,M,17/12/1985,Válido,20
20001,2451,,JOAO MENEZES DOS SANTOS,CONSELHEIRO JOHNNY MENEZES,M,08/10/1968,Válido,20
20133,2292,,RONAIB CARDOSO DA SILVA,NEY JÚNIOR,M,28/09/1976,Válido,20
20021,217,,JAILENE COELHO DA SILVA,JAILENE SILVA,F,01/02/1998,Válido,20
20778,494,,MATEUS RIBEIRO DE JESUS,MATEUSINHO SEU AMIGO,M,09/02/2002,Válido,20
20023,95,,DELEON ALVES RODRIGUES,DELEON RODRIGUES,M,12/02/1984,Válido,20
20345,320,,BENJAMIN DE ANDRADE BERNARDINO,ANDRADE DO ESPECIAL,M,22/03/1962,Válido,20
20180,4131,,DEBORA CRISTINA PEREIRA MAFRA,DELEGADA DÉBORA MAFRA,F,07/10/1969,Válido,20
20002,207,,LAURA LYS RODRIGUES BARBOSA,LAURA LYS,F,15/06/1982,Válido,20
20116,423,,SIMONE CABRAL VALENTE GONCALVES,SIMONE CABRAL,F,01/06/1975,Válido,20
17555,800,,JOSÉ MARIO FROTA MOREIRA,MARIO FROTA,M,22/02/1943,Válido,17
17770,562,,ROGÉRIO MENDES FERNANDES,SARGENTO ROGÉRIO,M,07/03/1982,Válido,17
17017,1602,,NILSON HIROSHI KANEHIRA SATO,NILSON SATO,M,28/01/1968,Válido,17
17029,22,,CLAUDIA DANIELI VIEGAS DOS REIS,VIEGAS,F,29/05/1984,Válido,17
17789,327,,RAMON PEDROSA FERREIRA,RAMON PEDROSA,M,21/02/1999,Válido,17
17131,9,,MIRIAN CORREIA TAVARES,MIRIAN TAVARES,F,17/12/1982,Válido,17
17013,269,,ROSANA APARECIDA BENTES DE OLIVEIRA DE SOUZA,ROSANA OLIVEIRA,F,26/06/1974,Válido,17
17113,317,,ERICO BEZERRA DA FONSECA,FONSECA,M,05/10/1961,Válido,17
17141,601,,CARLOS ANDRE COLARES FERREIRA,CABO COLARES,M,04/07/1983,Válido,17
17122,91,,VALDEISA FREITAS DE FIGUEIREDO,VALDEISA DE FIGUEIREDO,F,11/09/1972,Válido,17
17153,7,,RAQUEL DE FATIMA VERAS FERNANDES,RAQUEL FERNANDES,F,15/10/1983,Válido,17
17288,441,,ALMIR NUNES DA COSTA,ALMIR NUNES,M,15/05/1967,Válido,17
17171,73,,ROSEMI FERREIRA DA SILVA,ROSEMI FERREIRA,F,11/03/1967,Válido,17
17667,2179,,HUDSON ALMEIDA JORGE,HUDSON JORGE,M,22/11/1980,Válido,17
17010,83,,JOHN KAROL SOBRINHO DOS SANTOS,JOHN KAROL,M,20/11/1982,Válido,17
17617,968,,EDIVAN VIEIRA DE OLIVEIRA,CAPELÃO EDIVAN VIEIRA,M,25/07/1974,Válido,17
17190,215,,PAULO MOISÉS VIEIRA DOS SANTOS,PAULO VIEIRA,M,01/04/1983,Válido,17
17100,618,,LINDOMAR LIMA DE SOUZA,DR LINDOMAR LIMA,M,02/06/1982,Válido,17
17333,159,,EREMITA OLIVEIRA DA SILVA,EREMITA OLIVEIRA,F,18/09/1957,Válido,17
17023,35,,KEITEANNE TELES DE SOUZA,KEITE TELES,F,23/02/1984,Válido,17
17212,519,,PAULO ROBERTO DE SOUSA CARNEIRO,PAULO ROBERTO CARNEIRO,M,25/06/1983,Válido,17
17666,568,,PEDRO CAMILO GOMES DE VASCONCELOS DIAS,CAMILO DO PIT GAMENESS,M,11/05/1970,Válido,17
17077,224,,SERGIO LEONIDAS FERNANDES PINHEIRO,SERGIO LEONIDAS,M,07/10/1961,Válido,17
17651,428,,HELCIO PINHEIRO DE SOUZA,HELCIO SOUZA,M,27/11/1977,Válido,17
17003,501,,GILMAR DE LIMA AMBROSIO,GILMAR DA CIRANDA,M,18/06/1962,Válido,17
17456,744,,ELIAS SOUZA DE CARVALHO,ELIAS CARVALHO,M,10/07/1997,Válido,17
17321,2006,,JADNA DOS SANTOS BARROS,TC JADNA BARROS,F,17/04/1974,Válido,17
17234,162,,FRANCISCO DA SILVA ARAUJO,CHICO ARAUJO,M,27/05/1974,Válido,17
17170,447,,GILVAN PEREIRA DACIO,DR GILVAN DACIO,M,08/03/1977,Válido,17
17677,673,,CARLOS GONZAGA NUNES RIBEIRO,CARLOS GONZAGA,M,01/12/1963,Válido,17
17000,1795,,FÁBIO DE OLIVEIRA HUSS,MAJOR FABIO HUSS,M,02/07/1980,Válido,17
17070,158,,MAICON XAVIER DA SILVA ROSA,SARGENTO XAVIER,M,14/09/1982,Válido,17
17001,31,,JOÃO OCTÁVIO BELFORT DOS SANTOS BASTOS,JOÃO BELFORT,M,23/07/1964,Válido,17
17181,148,,FRANCISCO GOUVEA VIANA,FRANCISCO VIANA TATATY,M,02/06/1981,Válido,17
17771,325,,CELSO ANTONIO DA SILVEIRA,DR CELSO SILVEIRA,M,13/06/1961,Válido,17
17147,214,,JOSE DAMASCENO MENDES,DONIZETE DA VOZ,M,01/05/1974,Válido,17
17123,4859,,EVERTON ASSIS DOS SANTOS,EVERTON ASSIS,M,22/06/1974,Válido,17
17710,120,,LUCIANO COIMBRA DE OLIVEIRA,LUCIANO COIMBRA,M,03/04/1978,Válido,17
17777,1963,,LILIANE ARAÚJO DE ALMEIDA,LILIANE ARAÚJO,F,15/06/1982,Válido,17
17007,318,,GIOVANNA SOUSA E SILVA,GIOVANNA SOUSA,F,14/10/1998,Válido,17
17890,833,,MARCIA LEILA GAMA ARAUJO,MARCIA GAMA,F,27/05/1980,Válido,17
17187,49,,PRISCILA ASSUNÇÃO PAVESI,PRISCILA PAVESI,F,05/06/1983,Válido,17
17778,136,,ELIEZIO ALENCAR DE CASTRO,ELIEZIO CASTRO,M,13/06/1980,Válido,17
17021,89,,JACO MENEZES FERNANDES,JACO FERNANDES,M,21/01/1969,Válido,17
17700,621,,PETER SCHMIDT,CORONEL PETER,M,06/09/1965,Válido,17
17987,108,,OBEDE DO NASCIMENTO MOTA,OBEDE MOTA,M,20/09/1982,Válido,17
17177,225,,SEBASTIÃO CARLOS FERREIRA MAQUINÉ,CARLINHOS MAQUINÉ,M,29/03/1974,Válido,17
17111,4383,,DIEGO ROBERTO AFONSO,DIEGO AFONSO,M,29/05/1984,Válido,17
17557,151,,JOCILEIDE DE SOUZA PEREIRA,JUCY SOUZA,F,02/11/1965,Válido,17
17222,463,,FRANCISCO DAS CHAGAS COLARES VIGA,FRANCISCO VIGA,M,27/06/1968,Válido,17
17999,788,,ALAN DANGELO PINHEIRO,PROF ALAN PINHEIRO,M,23/01/1973,Válido,17
17012,161,,ALESSANDRO VIEIRA CARDOSO,ALEX CARDOSO,M,15/06/1974,Válido,17
17888,189,,CÉSAR AUGUSTO BARROSO DE ALBUQUERQUE,CESINHA DA AUTO ESCOLA,M,15/06/1968,Válido,17
17707,281,,IGLEISON ALVES CRISOSTOMO,TIO IGLÊ,M,13/08/1972,Válido,17
17380,119,,ANNE MARIE BATISTA NOGUEIRA,ANNE MARIE,F,03/09/1983,Válido,17
17133,373,,CESAR THIAGO QUARA RODRIGUES,THIAGO QUARA,M,19/01/1987,Válido,17
17038,398,,JÚLIO NUNES BEZERRA,JULIO NUNES,M,20/02/1982,Válido,17
17005,300,,MONICA RODRIGUES VANZIN,MONICA VANZIN,F,02/09/1979,Válido,17
17773,375,,IZABEL DE FATIMA BARBOSA,DONA BEL CAVALO DE AÇO VEICULO,F,04/11/1966,Válido,17
17517,1457,,JULIANA GONCALVES DE SOUZA ALEIXO,JULIANA ALEIXO,F,01/12/1983,Válido,17
17567,679,,JADER HELKER PINTO,JADER HELKER,M,26/06/1970,Válido,17
17447,109,,NATALIA FREITAS DE ARAUJO,PROFESSORA NATALIA FREITAS,F,04/01/1987,Válido,17
40040,351,,JAILSON SOUSA SILVA,CAIO DA COMUNIDADE,M,05/12/1971,Válido,40
40222,946,,CARLOS RENÊ DE SOUZA FERNANDES,CARLOS PORTTA,M,10/09/1978,Válido,40
40858,52,,ALEXANDER DOUGLAS CUNHA DE QUEIROZ,ALEXANDER QUEIROZ,M,10/09/1981,Válido,40
40376,180,,CLODOALDO DIAS DA SILVA,MESTRE CLODOALDO,M,02/08/1970,Válido,40
