numero,votos_nominais,situacao,nome,nome_urna,sexo,data_nasc,destino_voto,numero_partido
51900,531,Suplente,FERNANDO ALVES LORAS QUEIROZ,FERNANDO LORAS,M,19/01/1987,Válido,51
51222,447,Suplente,LUCIANA GONÇALVES BEZERRA,LUCIANA BEZERRA,F,10/02/1972,Válido,51
51700,912,Suplente,EDNEI LIMA PINHEIRO,EDNEI DA JUSTIÇA ,M,22/12/1971,Válido,51
51007,384,Suplente,LEILSON COSTA DE SOUZA,LEILSON SOUZA,M,18/04/1983,Válido,51
51200,955,Suplente,FRANCISCO LEONILSON CARLOS DE SOUZA,PROFESSOR LEO,M,18/07/1974,Válido,51
51141,73,Suplente,ELMARA CRISTINA FREITAS COELHO,ELMARA PERON,F,08/05/1974,Válido,51
51000,1245,Eleito,CARLOS AUGUSTO FARIAS DAMACENO,CARLOS DAMACENO,M,20/12/1985,Válido,51
51300,427,Suplente,JUAREZ DE JEZUS TAQUES,JUAREZ TAQUEZ,M,09/03/1957,Válido,51
51151,75,Suplente,TITO SOARES PAZ,TITO PAZ,M,27/09/1958,Válido,51
51234,439,Suplente,JOSE ELIZEU DOS SANTOS,ELIZEU SANTOS,M,17/03/1975,Válido,51
51555,628,Suplente,MARCIO VIEIRA DO CARMO,MARCIO POETA,M,18/11/1978,Válido,51
51888,759,Suplente,FRANCISCO ALENCAR DA SILVA,DELEGADO ALENCAR,M,31/01/1966,Válido,51
51001,86,Suplente,TALITA DE SOUZA LIMA FEITOSA,PASTORA TALITA FEITOSA,F,22/06/1967,Válido,51
51111,111,Suplente,CRISLANI BANDEIRA DE MELLO,CRIS MELLO,F,23/05/1994,Válido,51
51238,92,Suplente,LUCIMAR DA SILVA OLIVIERA,PASTOR LUCIMAR,M,20/09/1976,Válido,51
51789,486,Suplente,LUCINA DAS NEVES NUNES,LUCINA NUNES,F,08/08/1967,Válido,51
51051,88,Suplente,SILVIO ROBERTO SOUSA COSTA,SILVIO ROBERTO,M,19/06/1988,Válido,51
51277,100,Suplente,PAULO CARVALHO DE BARROS,PAULO CARVALHO,M,02/02/1977,Válido,51
51999,170,Suplente,GUDEMBERG DE OLIVEIRA RITA,GUDEMBERG,M,24/08/1973,Válido,51
51333,764,Suplente,ROSAN RODRIGUES BARBOSA,PASTOR ROSAN,M,02/06/1968,Válido,51
51400,159,Suplente,NAJARA LEANDRA DE OLIVEIRA,NAJARA LEANDRA,F,12/06/1985,Válido,51
51319,63,Suplente,ELINA COSTA DAMASIO,ELINA DAMASIO,F,26/07/1989,Válido,51
51551,622,Suplente,MARCELO RODRIGUES PEGO,MARCELO DO CAFE,M,17/08/1971,Válido,51
51678,86,Suplente,JANILSON CLENIO PEREIRA SANTOS,JANILSON CLENIO,M,04/02/1974,Válido,51
51100,493,Suplente,MARIO MARCELO BARROS DOS SANTOS,DOUTOR MARIO MARCELO,M,23/10/1972,Válido,51
51123,528,Suplente,CARLOS DE OLIVEIRA SILVA,CARLOS OLIVEIRA,M,07/08/1971,Válido,51
51444,404,Suplente,ILKA DA SILVA VIEIRA,DRA ILKA VIEIRA ADVOGADA,F,29/11/1972,Válido,51
51777,356,Suplente,CILAS RODRIGUES FILHO,SILAS FILHO,M,18/12/1977,Válido,51
51500,1927,Eleito,ISAQUE LIMA MACHADO,ISAQUE MACHADO,M,01/11/1977,Válido,51
51364,681,Suplente,SUELY BELARMINO DOS SANTOS,PROFESSORA SUELY BELARMINO,F,05/09/1966,Válido,51
51345,42,Suplente,JOSE CARLOS DE PAULA SALCEDO,CARLAO DO POVO,M,23/03/1970,Válido,51
51951,98,Suplente,SIMONE DOS SANTOS MAGAVEL,SIMONE SANTOS,F,05/11/1973,Válido,51
77533,30,Não eleito,ADRIANA PATRÍCIA DE OLIVEIRA PAIVA MORET DE FREITAS,ADRIANA PAIVA,F,07/11/1973,Válido,77
77222,62,Não eleito,WELLINGTON ALVES DE SOUZA,WELLINGTON LOURO,M,28/10/1969,Válido,77
77999,259,Não eleito,ALISANGELA LIMA FERREIRA,ALISANGELA LIMA,F,19/06/1972,Válido,77
77300,155,Não eleito,SILVIA ORIANI DE GRACIA LIMA,SILVIA ORIANI,F,28/06/1971,Válido,77
77200,180,Não eleito,ANTÔNIO ALVES FERREIRA,FERREIRINHA,M,18/07/1967,Válido,77
77900,2,Não eleito,RAIMUNDO DE PAULA AVELINO MACÊDO,RAIMUNDO DE PAULA,M,18/03/1979,Válido,77
77011,272,Não eleito,MARIA CONCEIÇÃO ALVES,PROFESSORA CONCEIÇÃO,F,30/04/1974,Válido,77
77190,784,Não eleito,SILVIO LUIZ RODRIGUES RAMALHO,SARGENTO RAMALHO,M,03/02/1975,Válido,77
77001,158,Não eleito,RUBEMAR MORAES DE SOUZA,RUBEMAR MORAES,M,15/08/1973,Válido,77
77333,240,Não eleito,LUIS HENRIQUE PEREIRA DE MIRANDA LOPES,LUISINHO MIRANDA,M,20/11/1970,Válido,77
77550,57,Não eleito,MARCOS WISNHER DOS SANTOS TERÇO,MARCOS TERÇO,M,18/01/1959,Válido,77
77800,8,Não eleito,GEANY DA SILVA MORAES,GEANY MORAES,F,15/01/1974,Válido,77
77321,114,Não eleito,JOSE JULIO QUEIROZ CHAVES,JÚLIO CHAVES,M,03/05/1963,Válido,77
77330,34,Não eleito,LUZIA MARÃES RODRIGUES,LUH  RODRIGUES,F,16/04/1972,Válido,77
77350,207,Não eleito,MARCIA DA SILVA FERREIRA,MARCIA FERREIRA,F,13/11/1975,Válido,77
77100,198,Não eleito,SEBASTIÃO WALTER SANTANA,SABA SANTANA,M,04/06/1956,Válido,77
77777,1226,Não eleito,JULIO ANDRE KASPER DA SILVA,JULIO KASPER,M,19/04/1987,Válido,77
77060,219,Não eleito,GILMAR DAS GRAÇAS SOARES,GILMAR DO RAIO X,M,09/08/1960,Válido,77
77227,54,Não eleito,PAULO MAIA DE SOUZA,PAULO MAIA,M,02/08/1965,Válido,77
77700,54,Não eleito,VALDECI FILHO RIBEIRO MELO,PROF. VALDECI RIBEIRO,M,12/10/1969,Válido,77
77000,77,Não eleito,LUCIANO FRANCISCO DA COSTA,LUCIANO COSTA,M,01/06/1992,Válido,77
10140,323,Suplente,ELTON LIMA GONÇALVES,ELTON LIMA,M,18/08/1987,Válido,10
10101,89,Suplente,EDILSON ALVES NASCIMENTO,EDILSON O COMBATENTE,M,22/09/1973,Válido,10
10300,56,Suplente,MARIA ANTONIA BEZERRA,TOINHA BEZERRA,F,06/09/1961,Válido,10
10333,146,Suplente,EDUARDO FELIPE DE OLIVEIRA LIMA,EDUARDO FELIPE,M,08/08/1984,Válido,10
10555,899,Suplente,LAELSON DA SILVA LIMA,LAELSON LIMA DO PLANALTO,M,10/09/1977,Válido,10
10789,1290,Eleito,EVERALDO ALVES FOGAÇA,FOGAÇA DO SITE O OBSERVADOR,M,23/03/1973,Válido,10
10444,1088,Suplente,RONEUDO SOARES FERREIRA,ENFERMEIRO RONEUDO SOARES,M,21/04/1976,Válido,10
10023,84,Suplente,FRANCISCO ABREU ROSAS,FRANCISCO PAPA LÉGUAS,M,30/01/1976,Válido,10
10500,156,Suplente,JOAO VIANA DE LIMA,JOAO VIANA,M,12/04/1974,Válido,10
10010,121,Suplente,ECILIO LIMA BELEZA,ECILIO LIMA,M,28/12/1978,Válido,10
10103,671,Suplente,ARIMAR SOUZA DE SÁ,ARIMAR SOUZA DE SÁ,M,06/10/1959,Válido,10
10111,49,Suplente,ANTONIA MARIA LOPES DE ALMEIDA,ANTONIA M LOPES,F,22/01/1974,Válido,10
10318,16,Suplente,DAGUIMAR LUSTOSA NOGUEIRA CAVALCANTE,DAGUIMAR CAVALCANTE,F,04/11/1978,Válido,10
10456,820,Não eleito,EZEQUIEL SOARES DA SILVA,EZEQUIEL SILVA,M,05/10/1977,Anulado sub judice,10
10070,31,Suplente,GLENDA BEZERRA DA SILVA,GLENDA BEZERRA,F,17/12/1991,Válido,10
10100,735,Suplente,JERRY ANTONIO FERREIRA NUNES,JERRY NUNES,M,01/06/1970,Válido,10
10888,829,Suplente,SAMUEL FERREIRA DA SILVA,SAMUEL MORUNGAPE,M,27/12/1980,Válido,10
10222,209,Suplente,SILVIA SADECK SOARES RODRIGUES,SILVIA SOARES,F,08/08/1969,Válido,10
10258,153,Suplente,JONATAN AIRES MOTA,JHONATAN MOTA,M,06/05/1992,Válido,10
10120,76,Suplente,LINDINALVA COSTA,LINDY DA TERRA SANTA,F,06/06/1979,Válido,10
10190,61,Suplente,LIGIA VIEIRA LIMA CARDOSO,CABO LIGIA,F,14/02/1987,Válido,10
10777,69,Suplente,VALMIR LEITE DE SOUZA,VALMIR XERETA,M,21/06/1967,Válido,10
10234,122,Suplente,GERALDO MACEDO DA SILVA,MACEDO SUCESSO,M,27/09/1966,Válido,10
10123,3722,Eleito,VANDERLEI DOS SANTOS SILVA,VANDERLEI SILVA,M,25/02/1977,Válido,10
10700,155,Suplente,PATRICIA CRISTINA DOS SANTOS MONTOIA,PATRICIA MONTOIA,F,23/02/1979,Válido,10
10220,45,Suplente,INEZ ROSA DOS SANTOS,INEZ ROSA,F,07/01/1969,Válido,10
10307,225,Suplente,MARCELO BOTELHO DE CARVALHO,MARCELO BOTELHO,M,13/01/1985,Válido,10
10007,734,Suplente,MOISES CRUZ VIEIRA,MOISES CRUZ,M,26/05/1977,Válido,10
10110,162,Suplente,VALDECIR ARAUJO FEITOSA,VALDECIR SORRISO,M,21/08/1981,Válido,10
10112,460,Suplente,CLEMILSON BENTES DO NASCIMENTO,PASTOR CLEMILSON,M,05/11/1976,Válido,10
10900,76,Suplente,RAILDA DOS SANTOS,RAILDA DA RAY CONFECÇOES,F,31/08/1968,Válido,10
10000,684,Suplente,WALDEMAR CAVALCANTE DE ALBUQUERQUE NETO,WALDEMAR NETO,M,27/02/1987,Válido,10
19333,3137,Eleito,ELLIS REGINA BATISTA LEAL OLIVEIRA,ELLIS REGINA DO SINDEPROF,F,14/10/1966,Válido,19
19222,149,Suplente,DANIELA ALVES MOTA LIMA,DANY LIMA,F,22/07/1986,Válido,19
19234,269,Suplente,IEDA DOS SANTOS NASCIMENTO,IEDA LOOGAM MOTOTAXI,F,02/02/1966,Válido,19
19444,1839,Eleito,JOSÉ IRACY MACÁRIO BARROS,DR MACÁRIO BARROS,M,09/04/1951,Válido,19
19077,1166,Suplente,LUIZMAR OLIVEIRA DAS NEVES,PROF. LUIZMAR NEVES,M,19/12/1981,Válido,19
19193,340,Suplente,RAIANI CARLA LEITE DA COSTA,RAIANI BIKE SAÚDE,F,12/08/1987,Válido,19
19789,151,Suplente,ADRIANA BORGES DE ANDRADE SOUZA,ADRIANA BORGES,F,29/04/1969,Válido,19
19011,55,Suplente,SÂMIA REGINA CARDOSO DA COSTA,SÂMIA COSTA,F,11/12/1972,Válido,19
19190,320,Suplente,JOSÉ ROBERTO BENTO DE FIGUEIREDO,SGT FIGUEIREDO,M,15/04/1963,Válido,19
19900,295,Suplente,VALDELEI ROSENDO RIBEIRO,VALDELEI DIMEL,M,28/01/1977,Válido,19
19000,1193,Suplente,ALYSON FIGUEIREDO DA SILVA DOMINGOS,ALYSON CUIABANO,M,19/04/1989,Válido,19
19888,575,Suplente,HELIAMARA RIBEIRO BEZERRA DE MENEZES,HELIA BM,F,19/11/1964,Válido,19
19010,112,Suplente,TEREZA SOARES VIEIRA DOS REIS,TEREZA REIS,F,16/08/1974,Válido,19
19019,1265,Suplente,JOSE FELIPE FILHO,FELIPE,M,22/09/1967,Válido,19
19009,56,Suplente,QUEILA CARDOSO FERREIRA,QUEILA CARDOSO,F,12/05/1987,Válido,19
19192,532,Suplente,RAYMISON CORREA DA SILVA,RAYMISON CORREA,M,18/01/1977,Válido,19
19800,511,Suplente,FRANCISCO DAS CHAGAS DA COSTA,MIRO COSTA,M,13/08/1961,Válido,19
19200,778,Suplente,DÊIVIDE LOPES DA SILVA,DEIVIDE SILVA,M,27/04/1989,Válido,19
19123,460,Suplente,JOSE BARBOSA REIS,ZÉ REIS,M,27/01/1962,Válido,19
19364,1240,Suplente,ANTÔNIO ENIVALDO FERREIRA MEDEIROS,ANTÔNIO MEDEIROS,M,27/10/1977,Válido,19
19119,1122,Suplente,FABRICIO DONIZETI RIBEIRO SILVA,FABRICIO DONIZETI,M,17/08/1983,Válido,19
19378,958,Suplente,WILLIAM FERREIRA DA SILVA,WILLIAN FERREIRA,M,07/02/1964,Válido,19
19999,2214,Eleito,GILBER ROCHA MERCES,DR GILBER,M,16/09/1986,Válido,19
19321,320,Suplente,SAINCLER LUIZ FARIAS REBOUÇAS,SAM REBOUÇAS,M,17/06/1991,Válido,19
19038,242,Suplente,ELIZANGELA BRASIL DO CARMO,ELIZANGELA BRASIL,F,22/11/1973,Válido,19
19777,617,Suplente,SEBASTIÃO LEITÃO DE ARAUJO,SABIÁ,M,21/02/1964,Válido,19
19122,168,Não eleito,LUIZ HENRIQUE ALVES,LUIZ HENRIQUE LINGUICINHA,M,30/04/1982,Anulado sub judice,19
19225,375,Suplente,DANILO RAMOS DA ROCHA,PROFESSOR SURDO DANILO RAMOS,M,06/11/1990,Válido,19
19100,169,Suplente,DIVINA ETERNA DA COSTA,DIVINA COSTA DA TRANSPOSIÇÃO,F,06/04/1967,Válido,19
19319,1055,Suplente,FRANCISCO RODRIGUES BARRETO JUNIOR,JÚNIOR DA VERSATIL,M,13/11/1981,Válido,19
19500,695,Suplente,EUDES FERREIRA DE ARAUJO,EUDES DO ELSINHO,M,27/08/1961,Válido,19
19555,230,Suplente,THIAGO CASTRO DE OLIVEIRA,ENGENHEIRO THIAGO CASTRO,M,16/04/1984,Válido,19
18888,41,Não eleito,ALEFI RAILLAN DE SOUZA RIBEIRO,ALEFI RAILLAN,M,06/10/1993,Válido,18
18123,98,Não eleito,ANGELITA DO MONTE PEREIRA,PROFESSORA ANGELITA,F,02/11/1972,Válido,18
18007,25,Não eleito,WANDERSON DA SILVA,REI DOS VARAIS,M,22/08/1962,Válido,18
13111,428,Não eleito,LODEILSON FERNANDES DA SILVA,FERNANDO DO SINTERO,M,12/07/1975,Válido,13
13777,45,Não eleito,SERGIO IBIAPINA,SERGIO ALEGRIA,M,15/10/1983,Válido,13
13999,103,Não eleito,VITORIA CORREA DOS SANTOS,PAULA VLASAK,F,27/03/1993,Válido,13
13245,32,Não eleito,EZEQUIEL SILVA MESQUITA,EZEQUIEL MESQUITA,M,24/12/1973,Válido,13
13444,785,Não eleito,LUCIANA DE OLIVEIRA E SILVA,LUCIANA OLIVEIRA,F,29/11/1972,Válido,13
13130,63,Não eleito,SEBASTIANA CLAUDIA SOARES DA SILVA,CLAUDINHA DO AGRARIO,F,26/05/1977,Válido,13
13000,258,Não eleito,WALDEMIR DE AGUIAR BASTOS,WALDEMIR,M,31/12/1959,Válido,13
13222,104,Não eleito,CHARLES JOSÉ CAMPOS FÉLIX,CHARLES SUPERAÇÃO,M,06/12/1981,Válido,13
13300,151,Não eleito,MOISÉS BENJAMIN RIBEIRO,MOISÉS RIBEIRO,M,29/05/1967,Válido,13
13333,329,Não eleito,ROSENILDA FERREIRA DE SOUZA SILVA,ROSA NEGRA,F,04/03/1969,Válido,13
13034,48,Não eleito,FRANCISCO RICARDO MARQUES FILHO,RICCA SAN,M,30/03/1980,Válido,13
13500,56,Não eleito,FRANCISCO GERALDO DE LIMA,GERALDO LIMA,M,28/04/1968,Válido,13
13456,181,Não eleito,FRANCIMAR SIMÃO DA SILVA DE CARVALHO,FRANCIMAR SIMÃO,M,02/03/1975,Válido,13
13200,49,Não eleito,RAIMUNDO NONATO SOARES,RAIMUNDO NONATO DA CUT,M,04/08/1962,Válido,13
13613,71,Não eleito,ITAMAR LOPES MANOEL,ITAMAR,M,26/03/1967,Válido,13
13113,129,Não eleito,FRANCISCO MARISSILVES PINTO DA SILVA,CHIQUINHO DO PT,M,04/10/1975,Anulado sub judice,13
13790,40,Não eleito,JOSÉ IRONILDO RODRIGUES NASCIMENTO,JOSE IRONILDO,M,13/10/1963,Válido,13
13005,22,Não eleito,JOÃO RODRIGUES DA SILVA,RODRIGO RODRIGUES,M,22/09/1953,Válido,13
13789,538,Não eleito,MARIA DE FATIMA FERREIRA DE OLIVEIRA ROSILHO,FATINHA,F,10/02/1971,Válido,13
13123,247,Não eleito,GILVANA MARIA NOLETO BARROS DA SILVA,GIOVANA BARROS SINDICALISTA,F,20/11/1966,Válido,13
13013,116,Não eleito,GARIVALDO FILIPPO DA SILVA RUSSO,PROFESSOR GARIVALDO,M,27/03/1964,Válido,13
13133,857,Não eleito,ALYNE MAYRA RUFINO DOS SANTOS,ALYNE MAYRA E COLETIVO,F,28/07/1989,Válido,13
45700,1165,Suplente,CLAUDINALDO LEÃO DA ROCHA,CLAUDI ROCHA,M,09/09/1970,Válido,45
45888,72,Suplente,LUZIA LAURA ZACARIAS FROTA,LAURA FROTA,F,14/01/1993,Válido,45
45017,191,Suplente,ELIEZER FERREIRA DA SILVA JUNIOR,ELI FERREIRA,M,02/06/1983,Válido,45
45444,1526,Eleito,MARCELO REIS LOUZEIRO,MARCELO REIS,M,16/08/1970,Válido,45
45333,25,Suplente,WALMILK SEVERIANO DOS SANTOS,WALMILK SEVERIANO,M,09/08/1962,Válido,45
45151,43,Suplente,MARIA FABIANA RODRIGUES MARQUES,FABIANA RODRIGUES,F,23/01/1991,Válido,45
45678,460,Suplente,ALDALBERTO ROSA DA SILVA,ADALBERTO,M,24/11/1967,Válido,45
45364,39,Suplente,HÉLIA DE JESUS BERNARDO,HÉLIA DA SAÚDE,F,28/12/1966,Válido,45
45100,278,Suplente,NEY SAMBORJENSE PITTALUGA LEAL NETO,NEY LEAL NETO,M,29/08/1991,Válido,45
45450,45,Suplente,MARCO ANTONIO VASCONCELOS,CAPITÃO VASCONCELOS,M,08/06/1969,Válido,45
45007,24,Suplente,MARIA CAVALCANTE BRITO,MARIA CAVALCANTE,F,07/09/1970,Válido,45
45127,80,Suplente,RAFAEL CORREIA MACÊDO,RAFAEL MACÊDO,M,27/12/1980,Válido,45
45773,23,Suplente,CARLA CRISTINA DA SILVA AZEVEDO,CARLA CRISTINA,F,07/05/1984,Válido,45
45197,65,Suplente,DONIZETE ALYPIO DA SILVA,DONIZETE DA CONSTRUÇÃO CIVIL,M,03/06/1970,Válido,45
45555,1465,Suplente,ALISSON CARREIRO LEMES,ALISSON SANDUBAS,M,28/11/1986,Válido,45
45125,65,Suplente,RODEILSON RAMOS LINDOSO,LINDOSO FILHO,M,14/11/1987,Válido,45
45111,99,Suplente,JOAQUIM FERREIRA DE SOUSA FILHO,JOAQUIM FILHO,M,22/04/1967,Válido,45
45136,1213,Suplente,RAIMUNDO SOARES DA COSTA,TOCO DO STICCERO,M,24/06/1975,Válido,45
45400,51,Suplente,EDILENE JUSTO DE SOUZA,BARBIE DO POVO,F,15/10/1981,Válido,45
45789,243,Suplente,FRANCISCA DAS CHAGAS LIMA SOBREIRA,PROFESSORA FRANCISCA SOBREIRA,F,24/01/1980,Válido,45
45005,22,Suplente,BERTA LUCIA DE AZEVEDO FAZZANO,BERTA LUTANDO PELA COMUNIDADE,F,25/12/1971,Válido,45
45123,1271,Suplente,WELLEM ANTÔNIO PRESTES CAMPOS,WELEM PRESTES,M,03/05/1966,Válido,45
45800,1040,Suplente,POLIANA NATALIA XIMENES RIOS,POLIANA XIMENES RIOS,F,19/07/1989,Válido,45
45777,1040,Suplente,GABRIELE MOREIRA GASPAR,GABRIELE GASPAR,F,03/04/1983,Válido,45
45105,40,Suplente,VALMIR BARBOSA MOURA,VALMIR DA REFRIGERAÇÃO,M,28/09/1983,Válido,45
45200,83,Suplente,JAMERSON EVENCIO DA SILVA,JAMERSON MERCOSUL,M,29/06/1986,Válido,45
45222,205,Suplente,ANA MARIA MOURA DE SOUZA,ANA MOURA,F,31/01/1967,Válido,45
45455,53,Suplente,MARIA DAS GRAÇAS ROCHA DOS SANTOS,GRAÇA ROCHA,F,11/05/1977,Válido,45
22222,1610,Suplente,FRANCISCO EVALDO DE LIMA,EVALDO DA AGRICULTURA,M,09/10/1973,Válido,22
22225,13,Não eleito,FRANCISCA AZEVEDO FERREIRA,FRANCISCA AZEVEDO,F,25/03/1988,Anulado sub judice,22
22122,517,Suplente,HERIKA LIMA FONTENELE,HERIKA FONTENELE,F,25/04/1971,Válido,22
22500,78,Não eleito,ELIANE BARROS DE ALMEIDA,LILI DA ZONA LESTE,F,06/02/1978,Anulado sub judice,22
22000,395,Suplente,GILMAR SILVA DE OLIVEIRA MOTA,GILMAR,M,08/04/1967,Válido,22
22007,12,Não eleito,MARCIO GOMES DE MIRANDA,MARCIO MIRANDA,M,25/08/1973,Anulado sub judice,22
22444,554,Suplente,RUBENS ALEINE DE MELLO NOGUEIRA,RUBENS DA FEIRA,M,02/04/1969,Válido,22
22501,95,Suplente,CARLOS HENRIQUE MAGALHÃES DE AMORIM,CARLOS AMORIM,M,22/03/1964,Válido,22
22789,46,Suplente,SANGELA DOS ANJOS CRUZ DE GOES,LINDA CRUZ,F,06/10/1983,Válido,22
22200,15,Não eleito,HELTON MAGALHAES MARQUES,HELTON MARQUES,M,16/08/1981,Anulado sub judice,22
22300,1391,Suplente,IVAN JORGE GONÇALVES,FERRUGEM,M,23/05/1985,Válido,22
22888,43,Suplente,JAQUELE GUTIERREZ DE SOUZA,JAQUELE GUTIERREZ,F,28/07/1974,Válido,22
22600,2527,Eleito,JURANDIR RODRIGUES DE OLIVEIRA,JURANDIR BENGALA,M,25/01/1963,Válido,22
22580,727,Suplente,JOAO BOSCO RODRIGUES,BOSCO ADMINISTRADOR,M,04/12/1960,Válido,22
22700,211,Suplente,MARIA DA PAZ MARTINS LIMA,MARIA DA PAZ MOÇA,F,26/01/1978,Válido,22
22133,1247,Suplente,JOSE RABELO DA SILVA,JACARÉ AMIGO DO POVO,M,13/11/1968,Válido,22
22234,33,Suplente,ROSANA LOBO ROSAS,ROSANA ROSAS,F,25/04/1988,Válido,22
22105,110,Suplente,ZACARIAS LEAO PEREIRA,ZACARIAS LEAO,M,26/04/1970,Válido,22
22100,35,Suplente,CLAUDIO MARZO SOARES VIEIRA,CLAUDIO MARZO,M,10/07/1975,Válido,22
22800,2284,Suplente,JOSE ASSIS JUNIOR REGO CAVALCANTE,JUNIOR CAVALCANTE,M,30/05/1977,Válido,22
22220,26,Suplente,MARISA APARECIDA AMORIM DE SOUZA,MARISA AMORIM,F,23/05/1970,Válido,22
22777,51,Suplente,RAIMUNDO CESAR DE LIMA,CESAR LIMA ,M,18/10/1966,Válido,22
22115,183,Suplente,ANTONIO CARLOS BARBOSA PEREIRA,BARBOSA BARBOSINHA,M,21/09/1960,Válido,22
22333,366,Suplente,CARLOS HENRIQUE CARVALHO LIMA,CARLOS FEDERADO,M,17/05/1969,Válido,22
22111,135,Suplente,DNYPHER JACQUELINE DA SILVA GONÇALVES,DHENNY MEL ,F,19/03/1987,Válido,22
22123,2724,Eleito,MILITINO FEDER JUNIOR,DR JUNIOR QUEIROZ,M,15/01/1980,Válido,22
22221,38,Suplente,ROSINALDO LUIZ DE ABREU MACHADO,R. MACHADO,M,28/08/1950,Válido,22
22555,1697,Suplente,SEBASTIAO GERALDO FERREIRA,TIÃOZINHO,M,13/01/1968,Válido,22
55111,423,Suplente,SIDNEY DE OLIVEIRA RODRIGUES,SIDNEY OLIVEIRA,M,24/12/1993,Válido,55
55999,359,Suplente,CRISTOVÃO CEZAR RODRIGUES SOARES,CRIS CEZAR,M,06/03/1970,Válido,55
55100,677,Suplente,LUCIANO LEAL DA COSTA LIMA,LUCIANO LEAL,M,08/02/1975,Válido,55
55199,817,Suplente,MARCELO SILVA DOS SANTOS,MARCELO DA DEFESA CIVIL,M,11/08/1972,Válido,55
55010,39,Suplente,LORIVÂNIA CAMPOS GÓES,VÂNIA GÓES,F,09/05/1979,Válido,55
55030,128,Suplente,JOZUÉ SOUSA ABREU DOMINGUEZ,JOZUÉ ABREU,M,06/12/1985,Válido,55
55122,300,Suplente,AYEL WELLINGTON MUNIZ DE OLIVEIRA,AYEL MUNIZ,M,06/07/1996,Válido,55
55777,72,Suplente,NATÃ SOUZA SILVA,NATÃ SOUZA,M,23/12/1995,Válido,55
55125,53,Suplente,IDEMAR SANTANA DE MEDEIROS,DEMA MEDEIROS,F,24/09/1965,Válido,55
55007,197,Suplente,ANTÔNIO CARLOS VIEIRA DO NASCIMENTO,TONHÃO PATROLEIRO,M,08/01/1978,Válido,55
55300,100,Suplente,JOYCE RAMALHO PIRES KONAGESKI,PROFESSORA JOYCE,F,31/03/1982,Válido,55
55000,260,Suplente,ARNALDO LOURENÇO,ARNALDO BUIU,M,17/02/1959,Válido,55
55222,720,Suplente,IURE MIQUILES PEDROZA,IURE PEDROZA,M,31/03/1986,Válido,55
55234,108,Suplente,ALTAMIRA PAIVA CAVALCANTE,PROFESSORA ALTAMIRA,F,29/12/1972,Válido,55
55888,883,Suplente,CARLOS MOISES DE OLIVEIRA,PROFESSOR MOISES,M,17/05/1965,Válido,55
55444,383,Suplente,BRUNO COELHO ALVES,BRUNO PETROLINO,M,18/09/1983,Válido,55
55800,462,Suplente,HIRAUDES PEREIRA ARAUJO,HIRAUDES DO AÇOUGUE,M,07/10/1972,Válido,55
55055,29,Suplente,BRUNA VALERIA MORAIS SILVA,BRUNA MORAIS,F,05/09/2000,Válido,55
55333,89,Suplente,MANOEL ALMEIDA DE AZEVEDO,MANOEL PAQUINHA,M,29/03/1971,Válido,55
55180,661,Suplente,ADELSON FRANCISCO DA SILVA,ADELSON COBRADOR,M,15/10/1971,Válido,55
55365,177,Suplente,JACIM ANTONINO COSTA,JACIM ANTONINO,M,12/02/1992,Válido,55
55123,93,Suplente,JULSIMARA DA SILVA OLIVEIRA,JULSIMARA OLIVEIRA,F,29/09/1965,Válido,55
55200,1185,Suplente,ROBERTO DILAMITE SOUSA,ENFERMEIRO ROBERTO DILAMITE,M,05/12/1977,Válido,55
55223,106,Suplente,ROSA DA CONCEIÇÃO SOUSA,ROSA DO PLANALTO,F,02/02/1970,Válido,55
55190,405,Suplente,FRANCISCO DE ASSIS DO CARMO DOS ANJOS,CABO ANJOS,M,02/05/1966,Válido,55
55456,285,Suplente,FÁBIO BOTELHO CAMELLO,FABINHO CAMELLO,M,28/03/1995,Válido,55
55345,9,Suplente,EDILÉIA BEZERRA DA SILVA,EDILÉIA BEZERRA,F,29/01/1991,Válido,55
55789,273,Suplente,ELIAS CORREA BARROS,ELIAS BARROS,M,08/05/1966,Válido,55
55555,1767,Eleito,NAIDIO RAI GONÇALVES FERREIRA WAGNER,RAI FERREIRA,M,14/08/1992,Válido,55
55039,0,Suplente,CICERA ROZIMEIRE OLIVEIRA DE CARVALHO,ROZIMEIRE CARVALHO,F,26/06/1981,Válido,55
90120,31,Suplente,ROSINEIDE MEDEIROS DE OLIVEIRA FRANCOLINO,PROFESSORA ROSE,F,11/03/1970,Válido,90
90222,465,Suplente,FRANCISCO JOSE FERNANDES ARRUDA,ARRUDA FALANDO,M,17/04/1971,Válido,90
90777,383,Suplente,ANDREIA PAULA CORDEIRO,ANDREIA CORDEIRO,F,06/12/1981,Válido,90
90456,440,Suplente,EDELMIRO PINTO DA SILVA,MIRO PVH,M,19/03/1967,Válido,90
90100,2191,Eleito,EDEVALDO MARCOLINO NEVES,EDEVALDO NEVES,M,17/08/1986,Válido,90
90123,211,Suplente,CARLOS ALBERTO FERREIRA DA SILVA,PROF CARLOS ALBERTO,M,20/11/1962,Válido,90
90111,535,Suplente,MARCELO ANDRE AZEVEDO VERAS BARROZO,MARCELO BARROZO,M,27/06/1987,Válido,90
90197,250,Suplente,JOSE RIBEIRO PASSOS FILHO,ZEZINHO RIBEIRO,M,04/12/1973,Válido,90
90044,19,Suplente,MARIA SILVA COSTA DE ALMEIDA,MARIA SILVA,F,20/06/1963,Válido,90
90966,5,Suplente,ZUILA DE OLIVEIRA BRAGA,PROF. ZUILA BRAGA,F,21/05/1957,Válido,90
90300,136,Suplente,FRANCISCO IVAN PRADO DE ALCANTARA,IVAN ELETRICISTA,M,20/09/1978,Válido,90
90556,158,Suplente,NILZA SOARES NOGUEIRA,NILZINHA GUERREIRA,F,01/08/1955,Válido,90
90917,16,Suplente,GENY MOREIRA DA SILVA,GENY DO AFRO,F,26/02/1946,Válido,90
90909,101,Suplente,FREDSON SOUZA RODRIGUES,FRANK PRIMAVERA,M,14/03/1973,Válido,90
90200,575,Suplente,JOEL FREITAS DE SOUZA,JOEL DA ENFERMAGEM,M,23/12/1973,Válido,90
90555,237,Suplente,KELI DE OLIVEIRA AFONSO,KELI OLIVEIRA,F,01/11/1981,Válido,90
90900,299,Suplente,GESILDO BRITO PEREIRA,GESILDO BRITO,M,27/03/1981,Válido,90
90127,112,Suplente,RAIMUNDO LINS TEIXEIRA,PROF RAY LINS,M,14/07/1977,Válido,90
90007,69,Suplente,XENOFONTE FERROSIL,XENOFONTE FERROSIL,M,24/01/1982,Válido,90
90190,356,Suplente,NEILTON ASSIS ABADIAS DO NASCIMENTO,ABADIAS,M,08/11/1978,Válido,90
90246,120,Suplente,JOAO CARLOS FERNANDES ALVES,CARLINHOS MARACANÃ,M,06/07/1952,Válido,90
90890,24,Suplente,EDWARD MOREIRA DA SILVA,EDWARD MOREIRA,M,13/01/1959,Válido,90
90263,112,Suplente,CARLOS CRISTINO OLIVEIRA CAPUTO,CARLOS CAPUTO,M,18/04/1976,Válido,90
90038,340,Suplente,MARIA EDICLEIA SILVA SANTOS,EDICLEIA SANTOS,F,28/09/1979,Válido,90
90789,351,Suplente,ADONIAS RODRIGUES DE DEUS,ADONIAS DE DEUS,M,12/11/1978,Válido,90
90000,97,Suplente,ELICA MACHADO DA SILVA,DRA ÉLICA MARQUES,F,03/01/1991,Válido,90
28100,59,Não eleito,JEANE PEREIRA VIEIRA,JEANE VIEIRA BONITA,F,05/12/1977,Válido,28
28789,547,Não eleito,JOÃO PANTOJA MONTEIRO,JOÃO MANDÍ,M,28/07/1963,Válido,28
28123,149,Não eleito,CRISTIANO BATISTA DO NASCIMENTO,PASTOR CRISTIANO,M,01/02/1984,Válido,28
28762,126,Não eleito,MARIA ALCINEIDE NUNES FERREIRA,NEIDE NUNES,F,28/04/1975,Válido,28
28456,127,Não eleito,WALTER ANDRADE MOURA FILHO,VALTINHO DO POVO,M,02/06/1962,Válido,28
28811,69,Não eleito,IGNÊS MADEIRO COLETTI,IGNÊS COLETTI,F,24/10/1985,Válido,28
28028,142,Não eleito,LENEILDO DA SILVA,LENEILDO CAPOTA,M,28/08/1978,Válido,28
28800,143,Não eleito,WILLIAM FERNANDES MORAES DE SOUZA,WILLIAM FERNANDES,M,11/10/1985,Válido,28
28579,130,Não eleito,RAIMUNDO ALDEMIR NASCIMENTO DOS SANTOS,RAIMUNDO ALDEMIR,M,23/05/1967,Válido,28
28458,126,Não eleito,RALISSA QUEIROZ LIMA E SILVA,RALISSA QUEIROZ,F,02/02/1983,Válido,28
28007,94,Não eleito,WASHINGTON CAMPOS VIEIRA,WASHINGTON CAMPOS,M,13/07/1966,Válido,28
28497,70,Não eleito,CARLENE BATISTA REGES,CARLENE REGIS,F,08/10/1974,Válido,28
28528,83,Não eleito,FRANCISCO PEREIRA MURCIA,CHICÃO PVH,M,14/03/1957,Válido,28
28107,1,Não eleito,ANA MARIA CORDEIRO TEIXEIRA DA SILVA,ANA LORA,F,16/04/1984,Válido,28
28333,147,Não eleito,MARCIA APARECIDA COSTA SILVA,MARCIA DA ASSESFAM,F,19/04/1959,Válido,28
28765,84,Não eleito,ANALU OLIVEIRA DE FREITAS,ANALU OLIVEIRA,F,09/08/1976,Válido,28
28122,31,Não eleito,WERBERTE ARAÚJO DO NASCIMENTO,WERBERTE ARAÚJO TURIDA,M,12/03/1989,Válido,28
28126,148,Não eleito,ADENICIO JOSÉ RIBEIRO,BAIANINHO DO CALADINHO,M,01/02/1960,Válido,28
28888,293,Não eleito,JERRY LUIS RIBEIRO,JERRY AMARAL,M,24/05/1973,Válido,28
28500,17,Não eleito,LAILTON ANDRADE FREIRE,LAILTON FREIRE,M,04/11/1986,Válido,28
28017,57,Não eleito,CHARLES GALDINO DE MACEDO,CHARLES BANDEIRA,M,18/12/1970,Válido,28
28138,16,Não eleito,APARECIDO BISPO DE OLIVEIRA,BISPO DE EXTREMA,M,14/07/1960,Anulado sub judice,28
28000,208,Não eleito,GILBERTO ANTONIO ANDRETTA VIGIATO,GIL VIGIATO,M,29/03/1973,Válido,28
28380,120,Não eleito,JOSÉ ROBERTO CAMPOS LEITE,JOSE LEITE,M,16/02/1966,Válido,28
28024,20,Não eleito,CIRLEIDE DOS SANTOS SILVA OLIVEIRA,CIRLEIDE OLIVEIRA,F,29/08/1970,Válido,28
20120,133,Não eleito,ENEMIAS CARLOS LOPES MUNIZ,NEEMIAS MUNIZ,M,22/06/1975,Válido,20
20777,69,Não eleito,FRANCISCA VALDECIRA FIALIS DINIZ CUNHA RAMOS,PROFª VALDECIRA,F,27/06/1962,Válido,20
20100,118,Não eleito,ELIZABETE GOMES DOS SANTOS,BETHE,F,25/07/1966,Válido,20
20333,386,Não eleito,WAGNER OLIVEIRA CHAVES,PR WAGNER TORQUATO,M,02/12/1973,Válido,20
20027,44,Não eleito,ELISANGELA LIMA AMORIM SOUTO,ELISANGELA SOUTO,F,27/01/1977,Válido,20
20400,129,Não eleito,RUBENS MACIEL DE SOUZA,RUBENS MACIEL,M,21/01/1980,Válido,20
20000,249,Não eleito,ROSIMERE MOREIRA MACIEL CAVALCANTE,PRª MEIRE,F,30/12/1979,Válido,20
20201,72,Não eleito,ANDERSON ROGÉRIO TORRES,ANDERSON TORRES,M,26/12/1981,Válido,20
20200,155,Não eleito,DANIEL DIOGO DE ARAÚJO JÚNIOR,DANIEL DIOGO,M,25/11/1969,Válido,20
20133,59,Não eleito,JOSE JULIAO BEZERRA, VIGILANTE JULIÃO,M,27/06/1972,Válido,20
20150,16,Não eleito,LUCIANA MOREIRA DE SOUSA,LUCIANA,F,07/11/1983,Válido,20
20500,163,Não eleito,RAIMUNDO GALVÃO TAVARES,RAIMUNDO DO JACI,M,07/02/1982,Válido,20
20020,126,Não eleito,MILTON SILVA FREIRE,MILTÃO DO VOLEI,M,03/10/1966,Válido,20
20190,144,Não eleito,JOÃO CARLOS DE OLIVEIRA,JOÃO CARLOS,M,17/09/1964,Válido,20
20300,1856,Não eleito,JOELNA RAMOS HOLDER AGUIAR,JOELNA HOLDER,F,17/11/1975,Válido,20
20123,1826,Não eleito,BRUNO LUCIANO DO COUTO ARAÚJO,PASTOR BRUNO LUCIANO,M,07/04/1979,Válido,20
20007,327,Não eleito,LUIZ ROBERTO DE OLIVEIRA BENTO,PROFESSOR ROBERTO DA BETA,M,21/07/1987,Válido,20
20732,56,Não eleito,LUZIA APARECIDA ALVES LIMA,PASTORA LUZIA,F,14/10/1987,Válido,20
