numero,votos_nominais,situacao,nome,nome_urna,sexo,data_nasc,destino_voto,numero_partido
11223,515,Suplente,ALZIR OLIVEIRA DE QUEIROZ,ALZIR QUEIROZ,M,16/06/1986,Válido,11
11190,216,Suplente,MÁRCIO CARLOS VENÂNCIO,SARGENTO VENÂNCIO,M,03/05/1975,Válido,11
11222,129,Suplente,RAIMUNDO ALZINO NOGUEIRA DOS SANTOS,ALZINO DA SAÚDE,M,17/02/1965,Válido,11
11600,193,Suplente,BENEDITO DA SILVA FERREIRA,TARCÍSIO FERREIRA,M,30/06/1967,Válido,11
11023,421,Suplente,SEBASTIÃO FREITAS SILVA,TIÃO FREITAS,M,20/04/1969,Válido,11
11100,290,Suplente,EDUILSON FELIX DINIZ,JORNALISTA EDU FÉLIX,M,01/03/1974,Válido,11
11123,312,Suplente,ALESSANDRO AUGUSTO JACOMINI BORGES,ALESSANDRO BORGES,M,27/10/1989,Válido,11
11500,1425,Eleito,MÁRCIA HELENA MARTINS HENRIQUE,MÁRCIA SOCORRISTAS ANIMAIS,F,01/05/1972,Válido,11
11400,53,Suplente,ELIANE MARIA DE SOUZA MATOS,ELIANE MATOS,F,03/01/1962,Válido,11
11001,148,Suplente,SALLY ANNE BOWMER BEÇA COUTINHO,DRA SALLY,F,08/10/1971,Válido,11
11999,242,Suplente,JOSÉ LIMA DAMASCENA,DANIELZÃO DO ESPORTE,M,20/03/1980,Válido,11
11364,63,Suplente,LÍVIA DA COSTA BRITO CAMELO,LÍVIA COSTA,F,21/07/1986,Válido,11
11180,103,Suplente,MÁRCIA MATIAS BARROS,MÁRCIA MATIAS,F,28/06/1982,Válido,11
11700,70,Suplente,KRISHNA SANTANA DA SILVA MUNIZ,PASTORA KRISHNA SANTANA,F,09/03/1974,Válido,11
11111,1265,Suplente,LUAN WENDEL MARTINS COSTA,LUAN DA TV,M,05/10/1992,Válido,11
11800,55,Suplente,CLEIDINARA ROCHA DOS SANTOS,CABO NARA ROCHA,F,14/11/1984,Válido,11
11789,255,Suplente,ANTONIO DE BARROS NETO,POETA DA TRANSPOSIÇÃO,M,09/05/1961,Válido,11
