numero,votos_nominais,situacao,nome,nome_urna,sexo,data_nasc,destino_voto,numero_partido
20130,154,Não eleito,DIÊMISSON BARRETO DE FREITAS,CURITIBA FILHO,M,25/02/1986,Válido,20
20700,18,Não eleito,FÁBIO RODRIGUES GRANGEIRO JÚNIOR,FÁBIO VARÃO,M,01/02/1989,Válido,20
20585,35,Não eleito,ÂNGELA MARIA CARDOSO DA SILVA,ANGELA DO ORGULHO,F,07/07/1976,Válido,20
20222,139,Não eleito,ÂNGELO RUAN OLIVEIRA DO NASCIMENTO,ÂNGELO DOS APROVADOS,M,20/01/1995,Válido,20
20555,45,Não eleito,DÉBORA VIANA DA SILVA,DÉBORA SILVA,F,22/12/1978,Válido,20
20022,29,Não eleito,HIULIANE MAIA DA SILVA,ANE SILVA,F,22/03/1988,Válido,20
20820,74,Não eleito,RONILDO FERREIRA LIMA,RONILDO LIMA,M,07/08/1980,Válido,20
20444,30,Não eleito,RONALDO MAGALHAES GONÇALVES,RONALDO MECANICO,M,18/06/1980,Válido,20
40258,86,Suplente,MARILDA BRASIL CAMARGO,MARILDA BRASIL,F,14/02/1965,Válido,40
40150,502,Suplente,ANA GLAIDE MONTEIRO DE MATOS,GLAIDE MATOS,F,10/01/1980,Válido,40
40333,18,Suplente,MARIA NELMISIA PRUDENCIO DE SOUZA,MARIA NELMISIA,F,24/10/1967,Válido,40
40000,72,Suplente,LIELZO IRVING SANTIAGO DE NEGREIROS,LIELZO IRVING LORINHO,M,30/11/1986,Válido,40
40190,80,Suplente,REGINALDO MARCELINO DE CASTRO,SGT MARCELINO,M,17/08/1968,Válido,40
40123,934,Suplente,JOSIAS BATISTA SILVA,JOSIAS PERITO,M,08/06/1973,Válido,40
40800,731,Suplente,JOSÉ GOMES BANDEIRA FILHO,DR BANDEIRA,M,23/11/1963,Válido,40
40555,1784,Suplente,ANTÔNIO CARLOS DA SILVA,DA SILVA DO SINTTRAR,M,19/09/1962,Válido,40
40500,69,Não eleito,ANÍZIO GORAYEB FILHO,ANÍSIO GORAYEB,M,15/03/1955,Anulado sub judice,40
40369,186,Suplente,FRANCISCO SANTOS LIMA,CHICÃO SANTOS,M,26/06/1963,Válido,40
40300,86,Suplente,CLOTILDES BRITO,CLOTILDES BRITO,F,11/07/1956,Válido,40
40140,3427,Eleito,FRANCISCO EDWILSON BESSA HOLANDA DE NEGREIROS,EDVILSON NEGREIROS,M,07/10/1973,Válido,40
40234,147,Suplente,ANDRÉ CARLOS VIEIRA CAETANO,ANDRÉ VIEIRA,M,14/03/1994,Válido,40
40888,46,Suplente,WANIR CAVALHEIRO,WANIR CAVALHEIRO,M,26/04/1953,Válido,40
40823,50,Suplente,EMERSON DA SILVA BEZERRA,BERSONDS BEZERRA,M,23/05/1983,Válido,40
40147,58,Suplente,JUCIMARA APARECIDA CARNEIRO,JUCIMARA BABALU,F,04/06/1989,Válido,40
40456,83,Suplente,MACIEL AURELIANO ANDRADE,MACIEL INSUFILM,M,12/06/1984,Válido,40
40222,1001,Suplente,DOMINGOS SÁVIO FERNANDES DE ARAUJO,DOMINGOS SÁVIO,M,02/03/1960,Válido,40
40364,251,Suplente,EDIVAN ALVES DA COSTA KAXARARI,EDIVAN KAXARARI,M,15/05/1979,Válido,40
40201,111,Suplente,CLAUDIO FALCÃO DOS SANTOS,CLAUDIO FALCÃO,M,17/03/1978,Válido,40
40111,471,Suplente,KLYCIA ROGELIA PAES DA MOTA,PROF. KLICIA TUCA,F,15/09/1970,Válido,40
40268,87,Suplente,EDUARDO JOSE CARDOSO,CARDOSO,M,02/06/1968,Válido,40
40100,2074,Suplente,SANDRO DE CARVALHO,PASTOR SANDRO,M,16/06/1969,Válido,40
40250,38,Suplente,RONALDO BUENO,RONALDO BUENO,M,09/04/1975,Válido,40
40104,237,Suplente,MARIA DAS GRAÇAS SOUZA DO NASCIMENTO,GRAÇA SACOLEIRA,F,27/03/1972,Válido,40
40444,12,Suplente,CAROLINE SUAREZ COSTA,CAROL SUAREZ,F,29/08/1996,Válido,40
40400,227,Suplente,CARLOS ANDRÉ MATIAS COSTA,CARLOS MATIAS,M,11/09/1972,Válido,40
40789,86,Suplente,FRANKLIN CASTELO OLIVEIRA,FRANKLIN CASTELO DA SAÚDE,M,20/10/1975,Válido,40
40852,244,Suplente,GILBERTO PEREIRA DOS SANTOS,GILBERTO JACARÉ,M,12/11/1966,Válido,40
40007,188,Suplente,KAREN DE OLIVEIRA DIOGO,KAREN OLIVEIRA,F,15/03/1969,Válido,40
40200,2856,Eleito,MARCIO PACELE VIEIRA DA SILVA,MARCIO PACELE,M,03/11/1975,Válido,40
40221,33,Suplente,MARIA ZILDA VIEIRA PAIVA,ZILDINHA,F,06/06/1970,Válido,40
14190,136,Suplente,VALDENNILO AGUIAR PINHEIRO,CABO AGUIAR,M,02/09/1982,Válido,14
14100,82,Suplente,PETERSON FREITAS INACIO,PETERSON FREITAS,M,10/10/1980,Válido,14
14111,82,Suplente,MARISSON MARCELO BATISTA DE ARAUJO,MARCELO ARAÚJO,M,12/01/1978,Válido,14
14123,40,Suplente,WALDEMIR GOMES DE ARAUJO,JUNIOR ROFRON,M,18/08/1974,Válido,14
14143,42,Suplente,JOSEFINA FRANCISCA DOS SANTOS BASTOS,JOSEFINA BASTOS,F,04/05/1959,Válido,14
14765,27,Suplente,DRIELE RODRIGUES LUSTOSA,DRIELE LUSTOSA,F,02/09/1987,Válido,14
14999,477,Suplente,DAISON NOBRE BELO,DAISON NOBRE BELO,M,10/10/1971,Válido,14
14456,169,Suplente,MAGNO DE ANDRADE MOURA,PROF MAGNO,M,31/03/1977,Válido,14
14600,1047,Suplente,FRANCISCO LIMA DE SIQUEIRA JUNIOR,JUNIOR SIQUEIRA,M,18/01/1965,Válido,14
14380,41,Suplente,ADRIANA BARROSO TRINDADE CORDEIRO,ADRIANA TRINDADE,F,14/03/1980,Válido,14
14500,48,Suplente,CARLOS EDUARDO RODRIGUES CABRAL,DUDU CABRAL,M,27/05/1979,Válido,14
14888,32,Suplente,MARIA SONIA CARVALHO SILVA,SONIA DO MERCADO CENTRAL,F,15/04/1974,Válido,14
14140,60,Suplente,ELIANE YAMAMOTO VIEIRA,ELIANE YAMAMOTO,F,06/05/1985,Válido,14
14222,2950,Eleito,ALEKSANDER ALLEN NINA PALITOT,PROFESSOR ALEKS PALITOT,M,27/09/1978,Válido,14
14333,58,Suplente,SELIANE DE SOUZA COSTA,SELIANE DE SOUZA,F,03/06/1996,Válido,14
14555,311,Suplente,MOISES MARINHO DA SILVA,DR MOISES MARINHO,M,16/11/1974,Válido,14
14223,264,Suplente,ALDIMAR LIMA DOS REIS,DINHO REIS,M,04/02/1972,Válido,14
14233,2,Suplente,ETELVINA ROSA DE MACEDO DE CARVALHO,PASTORA ETELVINA,F,17/05/1973,Válido,14
14114,9,Suplente,GEOVANI MIRANDA,PASTOR GEOVANI,M,26/10/1977,Válido,14
14477,78,Suplente,MARCOS AUGUSTO GOMES SUSSUARANA,PROF MARCOS SUSSUARANA,M,16/12/1965,Válido,14
14444,87,Suplente,MARIA RAIMUNDA COSMO DE ARRUDA,RAY ARRUDA,F,16/02/1967,Válido,14
14777,16,Suplente,ROBERVAL ROBERTO AMORIM DE CARVALHO,ROBERVAL ROBERTO,M,26/06/1964,Válido,14
14230,230,Suplente,GLADSTONE NOGUEIRA FROTA,GLADSTONE DA FARMAPLUS,M,15/07/1964,Válido,14
14789,666,Suplente,EDICARLOS DE SOUZA TRINDADE,EDICARLOS TRINDADE,M,04/01/1978,Válido,14
14404,40,Suplente,LUCIANA DOS SANTOS CARVALHO,LUCIANA CARVALHO,F,24/10/1981,Válido,14
14567,905,Suplente,JOAO BOSCO COSTA,BOSCO DA FEDERAL,M,26/09/1956,Válido,14
14226,280,Suplente,MAICOW ASSIS BERNARDES FLORES,PASTOR MAICOW,M,07/12/1982,Válido,14
14101,312,Suplente,ADRIANO FERREIRA DE MELLO,ADRIANO DE UNIAO BANDEIRANTES,M,20/02/1977,Válido,14
16364,62,Não eleito,EDVALDO CORDEIRO DA SILVA,DIDAS CORDEIRO,M,18/06/1967,Válido,16
16333,17,Não eleito,JACKELINE ROCHA SALES,JACKELINE,F,05/06/1979,Válido,16
16123,37,Não eleito,JOÃO CAVALCANTE DE OLIVEIRA,JOÃO PINTOR,M,04/04/1959,Válido,16
17000,576,Não eleito,SÍCILIA MARIA ANDRADE,SIÇA DA BANDA,F,17/11/1981,Válido,17
17456,187,Não eleito,JOÃO CARLOS TAVARES RAMOS,JOÃO RAMOS JK,M,28/04/1969,Válido,17
17333,136,Não eleito,ELIÉZER DE OLVEIRA LIMA MORAIS,ELIÉZER LIMA,M,30/12/1974,Válido,17
17007,230,Não eleito,ELIANE LIMA BARROS,ELIANE BARROS,F,01/02/1981,Válido,17
17217,375,Não eleito,JUAREZ DO NASCIMENTO,JUAREZ DA SAÚDE,M,29/12/1973,Válido,17
17009,192,Não eleito,ABGÁ REGNAUTH PINTO DE SÁ,ABGÁ REGNAUTH ,M,11/08/1971,Válido,17
17123,122,Não eleito,IASMIN LUCAS DE AMORIM,YASMIN AMORIM,F,25/01/1990,Válido,17
17771,32,Não eleito,PATRÍCIA DANIELE DOS ANJOS MELO,PATRICIA MELO,F,24/10/1980,Anulado sub judice,17
17067,89,Não eleito,MARINA GARCIA DOS SANTOS,MARI DO TREINO DE RUA,F,17/03/1996,Válido,17
17031,14,Não eleito,ELTON FABIAN ASSIS DE ANDRADE OLIVEIRA,ELTON FABIAN,M,23/12/1988,Válido,17
17222,211,Não eleito,CÁSSIO MOURA SILVA,CÁSSIO CHRISÓSTOMO,M,16/10/1986,Válido,17
17200,306,Não eleito,JOSÉ RAIMUNDO MARTINS DO NASCIMENTO,ZEZINHO NASCIMENTO,M,10/06/1957,Válido,17
17677,33,Não eleito,LUTIANY CUNHA BARBOSA,LUTIANY BARBOSA,F,14/11/1978,Válido,17
17400,172,Não eleito,LUIS ROBERTO ALMEIDA SOUSA,LUIS ALMEIDA ,M,06/10/1975,Válido,17
17337,58,Não eleito,FRANCISCO JOSIAS RODRIGUES ALVES,JOSIAS DA MARCENARIA,M,03/03/1977,Válido,17
17100,116,Não eleito,EDUARDO MENEZES MARQUES,SARGENTO MENEZES,M,28/01/1961,Válido,17
17019,184,Não eleito,UIRA CARVALHO FROES,UIRÁ FRÓES,M,18/12/1987,Válido,17
17300,62,Não eleito,HELTON TEIXEIRA DIAS,HELTON DIAS,M,22/02/1989,Válido,17
17017,300,Não eleito,ETIEL BRASIL DO CARMO,ETIEL BRASIL,M,16/05/1981,Válido,17
17777,767,Não eleito,EMERSON ALEXANDRE RODRIGUES,ALEXANDRE POTENCIA,M,25/09/1979,Válido,17
17607,136,Não eleito,LÚCIA REJANE FEITOSA DO AMARAL, REJANE FEITOSA,F,07/06/1977,Válido,17
17890,206,Não eleito,CLAUDEMIR PEREIRA DA SILVA,CLAUDEMIR,M,20/12/1974,Válido,17
17190,22,Não eleito,WESLEY LIMA DA SILVA,WESLEY LIMA,M,26/03/1987,Válido,17
43333,525,Suplente,MACILON VIEIRA DE SOUZA,MACILON VIEIRA,M,13/10/1981,Válido,43
43336,256,Suplente,WALDECY PEREIRA DE FREITAS,FREITAS DO AEROCLUBE,M,14/07/1969,Válido,43
43000,196,Suplente,CLAUDIANO SANTOS COSTA,CLAUDIANO SANTOS,M,10/12/1984,Válido,43
43222,785,Suplente,PEDRO GEOVAR RIBEIRO JUNIOR,PEDRO GEOVAR,M,28/09/1984,Válido,43
43319,25,Suplente,SÂMIA DOS SANTOS NOGUEIRA CAMURÇA,SÂMIA CAMURÇA,F,30/10/1974,Válido,43
43103,129,Suplente,ADRIANA BANDEIRA PINTO KATO,ADRIANA BANDEIRA,F,10/03/1973,Válido,43
43111,299,Suplente,FRANCISCO MIRANDA FREITAS,APODI,M,10/02/1985,Válido,43
43234,76,Suplente,JOAO FABIO SIQUEIRA DE QUEIROZ AMARAL,JOÃO FÁBIO VIGILANTE,M,24/04/1982,Válido,43
43321,45,Suplente,ODALEIDE CAMPOS DE CARVALHO,ODALEIDE CARVALHO,F,06/10/1971,Válido,43
43214,311,Suplente,EVELIN CAROLINE DE BARROS ALVES VELOZO,EVELIN CAROLINE,F,23/12/1984,Válido,43
43700,199,Suplente,MARIA MADALENA FARIAS FERNANDES GOMES,MADÁ,F,16/02/1970,Válido,43
43007,68,Suplente,CINEZIO MARCEL FARIAS DE LIMA,CINEZIO,M,06/08/1972,Válido,43
43013,200,Suplente,JOSE DA SILVA RAMALHO SOBRINHO,PROFESSOR RAMALHO,M,13/10/1964,Válido,43
43500,901,Suplente,SOLANGE DA SILVA GOMES,SOLANGE DA FEIRA,F,23/07/1975,Válido,43
43140,139,Suplente,VICENTE DE PAULO NETO,VICENTE DE PAULO,M,27/03/1965,Válido,43
43171,114,Suplente,FRANÇA DA SILVA ALVES,FRANÇA SILVA,M,07/05/1965,Válido,43
43210,97,Suplente,MARCOS EMIDIO DOS SANTOS,MARCOS EMIDIO,M,11/12/1971,Válido,43
43555,103,Suplente,NILSA ALMEIDA COSTA,NILSA ALMEIDA,F,10/11/1959,Válido,43
43200,96,Suplente,VICENTE RIBEIRO DOS SANTOS,VICENTE RIBEIRO,M,12/06/1973,Válido,43
43900,1493,Suplente,CLEVELAND RODRIGUES HERON,CLIVER HERON,M,28/06/1962,Válido,43
43123,1711,Suplente,NILTON DE SOUZA MELO,NILTON SOUZA,M,24/12/1983,Válido,43
43456,664,Suplente,EDMO FERREIRA PINTO,DIM DIM,M,21/05/1972,Válido,43
43043,1337,Suplente,LUIZ INACIO GUEDES COELHO,LUIZ COELHO,M,14/06/1992,Válido,43
43567,766,Suplente,PORFIRIO COSTA E SILVA,PORFIRIO COSTA,M,06/02/1970,Válido,43
43122,12,Suplente,ROSILENE GONÇALVES SANTOS,ROSE DA PONTA DO ABUNÃ,F,09/07/1979,Válido,43
43789,230,Suplente,ALDENOR PASSOS DAS NEVES,NEVES DO TRANSPORTE,M,11/10/1969,Válido,43
43444,309,Suplente,MARIA DE JESUS VALE DA SILVA,DUDA VALLES,F,28/05/1970,Válido,43
43120,161,Suplente,SÔNIA MARIA DOS SANTOS PEREIRA,SÔNIA MARIA,F,03/01/1964,Válido,43
43643,373,Suplente,CLARINDO ROMÃO NETO,ROMÃO NETO,M,28/08/1978,Válido,43
43777,169,Suplente,JOSE BISPO DE MORAIS FILHO,J BISPO,M,16/12/1973,Válido,43
43100,1806,Eleito,WANOEL CHAVES MARTINS,WANOEL,M,24/06/1980,Válido,43
43800,525,Suplente,RENATO CORREA LEAL,RENATO LEAL,M,12/04/1970,Válido,43
50222,37,Não eleito,ROBSON ALVES DE SA,COMANDANTE ROBSON,M,28/11/1957,Válido,50
50171,97,Não eleito,JOBERDES BONFIM DA SILVA,ENCARREGADO BEL,M,23/06/1962,Válido,50
50234,18,Não eleito,REGIO AFONSO FERNANDES PEREIRA,REGIO DO MORAR MELHOR,M,02/12/1970,Válido,50
50349,16,Não eleito,RICARDO MONTEIRO DE SOUSA,RICARDO MOTOTAXI,M,09/10/1980,Válido,50
50000,118,Não eleito,ERIQUE LUCENA SILVA,ERICK LUCENA,M,07/10/1986,Válido,50
50801,52,Não eleito,VERIDIANA LEITE DA MOTA,VERIDIANA MOTA,F,15/09/1980,Válido,50
50364,33,Não eleito,TELMA SANTOS DA CRUZ,DRA TELMA,F,01/11/1965,Válido,50
50123,72,Não eleito,OTACÍLIO DA SILVA MAIA,OTACÍLIO MAIA,M,01/02/1964,Válido,50
50555,44,Não eleito,VANESSA DOS SANTOS LEMOS,VANESSA SANTOS,F,10/11/1990,Válido,50
27888,292,Não eleito,NEEMIAS NUNES DE OLIVEIRA,MECANICO OLIVEIRA,M,25/09/1972,Válido,27
27727,1,Não eleito,EDNA PEREIRA DE SOUZA,EDNA DA KAARISMA MENSAGENS,F,22/07/1981,Válido,27
27147,49,Não eleito,ROSEVALDO DA SILVA RIOJAS,ROSEVALDO RIOJAS,M,14/08/1970,Válido,27
27333,113,Não eleito,RAIMUNDA LUCIA DA SILVA TEIXEIRA,LUCIA DA TEIXEIRA,F,27/07/1972,Válido,27
27222,142,Não eleito,ALCEBIADES FLAVIO DA SILVA,ALCEBIADES FLAVIO,M,14/06/1957,Válido,27
27000,86,Não eleito,ADALBERTO BRAGA DA CRUZ MOURA,BETO BRAGA,M,23/02/1990,Válido,27
27555,35,Não eleito,FABIANO JOSE TEIXEIRA NUNES,FABIANO PAI DA MATA,M,03/05/1981,Válido,27
27123,48,Não eleito,CICERO ANANIAS DO NASCIMENTO,CICERO CABECA BRANCA,M,16/05/1961,Válido,27
70227,1417,Suplente,RENATA QUEIROZ CAMURÇA,RENATA CAMURÇA,F,27/10/1982,Válido,70
70999,797,Suplente,THIAGO GONÇALVES DE MORAES,THIAGÃO 9,M,04/02/1985,Válido,70
70223,100,Suplente,JANILCE DE OLIVEIRA AMORIM DA SILVA,PASTORA JANILCE AMORIM,F,15/07/1976,Válido,70
70100,1565,Eleito,EDIMILSON DOURADO GOMES,EDIMILSON DOURADO,M,04/09/1979,Válido,70
70777,241,Suplente,ELIEL DERMONI DE CARVALHO,ELIEL ALEGRIA,M,22/05/1976,Válido,70
70070,617,Suplente,ALEXANDRE SILVA DE OLIVEIRA FILHO,ALEXANDRE SILVA,M,17/09/1981,Válido,70
70123,1554,Suplente,FRANCISCO FERREIRA DOS SANTOS,CHIQUINHO DO SINTAX,M,09/12/1960,Válido,70
70333,162,Suplente,ROSA MARIA SOUZA LIMA PONTES,ROSA PONTES,F,20/10/1968,Válido,70
70321,574,Suplente,MARCIA ROCHA DE OLIVEIRA FRANCELINO,PROFESSORA MARCIA ROCHA,F,19/04/1983,Válido,70
70400,69,Suplente,SALMIM COIMBRA SAUMA,DR. SALMIM COIMBRA,M,19/07/1967,Válido,70
70221,901,Suplente,IOLANDA RODRIGUES MOREIRA,ENFERMEIRA IOLANDA MATIAS,F,29/02/1968,Válido,70
70009,34,Suplente,ROSA MARIA LOPES ALVES,ROSA MARIA,F,16/09/1965,Válido,70
70222,28,Suplente,JOSUE BELZE FERREIRA,BELZ FERREIRA,M,27/03/1966,Válido,70
70500,294,Suplente,FRANCISCO PERES FERREIRA,PASTOR PERES,M,23/10/1976,Válido,70
70700,180,Suplente,FERNANDA SOARES PEIXOTO FERREIRA DA SILVA,FERNANDA FERREIRA,F,25/07/1985,Válido,70
70007,509,Suplente,WALDEMIR FREIRE MACHADO,WALDEMIR MACHADO,M,08/02/1966,Válido,70
70199,97,Suplente,NATALINO GOMES DOS SANTOS GASPAR,GASPAR DA SANTA LUZIA,M,29/12/1977,Válido,70
70456,774,Suplente,JULIO CESAR SIQUEIRA,JULIO CESAR,M,02/07/1972,Válido,70
70888,212,Suplente,VALDIR FERREIRA LIMA JUNIOR,VAVÁ FERREIRA,M,16/09/1990,Válido,70
70117,152,Suplente,LUCAS CAMARA QUEIROZ,LUCAS CÂMARA,M,24/11/1994,Válido,70
70444,287,Suplente,MANOEL MATOS SILVA,PASTOR MAURÍCIO MATOS,M,15/05/1960,Válido,70
70111,497,Não eleito,CLAUDIO PEREIRA DOS SANTOS,CLAUDIO DO ULISSES,M,16/06/1976,Anulado sub judice,70
70300,1696,Eleito,PAULO TICO FLORESTA,PAULO TICO,M,24/08/1969,Válido,70
70001,1189,Suplente,JEFSON ANDRADE MONTE,JEFSON MONTES,M,05/01/1991,Válido,70
70555,52,Suplente,NILDA MARIA CONCEIÇÃO DE SOUZA,NILDA SOUZA,F,11/05/1970,Válido,70
70789,941,Suplente,MARIA RITA DA SILVA SOUZA,MARIA RITA,F,25/12/1999,Válido,70
15122,137,Suplente,MARIA DAS DORES DA CONCEIÇÃO,DORA MARIA,F,02/06/1970,Válido,15
15121,184,Suplente,ROSA MARIA DE ASSIS SOBRAL,ROSA SOBRAL,F,09/02/1967,Válido,15
15159,46,Não eleito,LIVIA LEITE SANTOS,LIVIA SANTOS,F,09/03/1990,Anulado sub judice,15
15678,222,Suplente,BRUNA GOMIDE DA SILVA,BRUNA GOMIDE,F,02/07/1982,Válido,15
15555,400,Não eleito,WALTER WALTENBERG SILVA JUNIOR,DR WALTER WALTENBERG,M,16/11/1958,Anulado sub judice,15
15999,524,Suplente,RENAN PAES CAETANO,RENAN BLACK,M,04/01/1992,Válido,15
15151,354,Suplente,JOAO BATISTA BARBOSA,FERRUJO,M,21/12/1969,Válido,15
15111,129,Suplente,THAIS ROSEMAR SOARES DE SOUSA,THAIS ROSEMAR,F,25/06/1996,Válido,15
15777,56,Suplente,VANDERLEY BATISTA DE SOUZA,VANDERLEY ROBERTO ,M,12/06/1959,Válido,15
15300,183,Suplente,CECILIA ALVES DE OLIVEIRA CARVALHO,CECILIA CARVALHO,F,08/04/1969,Válido,15
15140,2270,Eleito,MÁRCIO JOSÉ SCHEFFER DE OLIVEIRA,MÁRCIO OLIVEIRA,M,17/07/1985,Válido,15
15000,28,Suplente,MARCELO POSTIGO CALDAS,IRMÃO MARCELO,M,16/07/1985,Válido,15
15321,11,Suplente,ADEMAR SEBASTIAO DE SOUZA,ADEMAR DE SOUZA,M,03/11/1962,Válido,15
15117,68,Suplente,MARIA VIEIRA DA SILVA,MARI ZANOTTO,F,15/08/1974,Válido,15
15333,24,Suplente,JOSE BENEDITO LOPES,BENE,M,15/03/1947,Válido,15
15222,271,Suplente,JOÃO BATISTA NAVA FILHO,DR NAVA,M,28/05/1956,Válido,15
15567,76,Suplente,DAVID LIMA DE BRITO,DAVID LIMA,M,19/03/1985,Válido,15
15420,26,Suplente,SEBASTIAO FERREIRA SOUSA,SEBASTIAO,M,20/01/1977,Válido,15
15888,65,Suplente,DAIANA HUFF,DAIANA HUFF,F,04/03/1987,Válido,15
15364,420,Suplente,IRINEU ANTONIO HOFSTETTER,IRINEU,M,11/05/1955,Válido,15
15200,416,Suplente,VANESSA PAZ DE CASTRO,VANESSA PAZ,F,02/02/1980,Válido,15
15100,603,Suplente,DABSON BUENO DA SILVA,DABSON BUENO,M,24/05/1984,Válido,15
15123,306,Suplente,MARIA RITA DO PERPETUO SOCORRO ARAUJO SOARES,MARIA RITA ARAUJO,F,26/08/1967,Válido,15
15800,335,Suplente,FRANCISCO JOSE DE CARVALHO TORRES,RACHID TORRES,M,05/08/1969,Válido,15
23777,428,Não eleito,VALDINÉIA BARRETO COELHO,PROFESSORA VAL BARRETO,F,10/11/1985,Válido,23
23223,139,Não eleito,LÚCIA VILHALVA VIOTTO,TIA LÚCIA DA CRECHE,F,31/07/1956,Válido,23
23789,149,Não eleito,ROSENILTON DE ARAÚJO NEVES,NILTINHO NEVES,M,14/06/1972,Válido,23
23222,412,Não eleito,SID ORLEANS CRUZ,SID ORLEANS,M,02/08/1969,Anulado sub judice,23
23224,9,Não eleito,ALCILENE PAIVA DE ARAÚJO,ALCILENE PAIVA,F,17/07/1982,Válido,23
23333,308,Não eleito,TIAGO LINS DE LIMA,TIAGO LINS,M,16/01/1984,Válido,23
23813,82,Não eleito,RENATA EVANS VALENTE DE QUEIROZ,RENATA EVANS,F,10/07/1967,Válido,23
23444,330,Não eleito,CAROLINE PONTES BEZERRA,CAROLINE PONTES,F,24/10/1995,Válido,23
23321,283,Não eleito,SILVANA DEVACIL SANTOS,DRA SILVANA DEVACIL,F,23/09/1985,Válido,23
23000,36,Não eleito,ANDRÉ FERREIRA DE LIMA,ANDRÉ LIMA,M,31/10/1992,Válido,23
23190,105,Não eleito,JADEILSON MARTINS DA CRUZ BRAGA,SARGENTO CRUZ MAGU,M,12/05/1975,Válido,23
23689,197,Não eleito,HIAGO PAIVA CARDOSO,PROFESSOR HIAGO PAIVA,M,02/07/1992,Válido,23
23456,82,Não eleito,PRISCILLA PANTOJA,PRISCILLA DE CALAMA,F,10/08/1978,Válido,23
23555,230,Não eleito,ALDENÍSIO RODRIGUES DE BRITO JÚNIOR,ALDENÍSIO JÚNIOR,M,01/03/1997,Válido,23
23737,37,Não eleito,AURENICE LEMOS MOURÃO,NICE LEMOS,F,07/11/1969,Válido,23
23123,272,Não eleito,ROSSINI LANDY CARVALHO DE SÁ,ROSSI DE SÁ,M,13/07/1971,Válido,23
23500,135,Não eleito,ARTUR PEREIRA MALDONADO,DR ARTUR MALDONADO,M,19/02/1986,Válido,23
23193,86,Não eleito,ROZANGELA SILVA DE OLIVEIRA,SGT ROZANGELA,F,14/02/1982,Válido,23
23232,266,Não eleito,JULIANA DE MOURA MELO,JULIANA MELO,F,06/02/1981,Válido,23
23723,223,Não eleito,ELIZETE GOMES SANTOS,PROFESSORA ELIZETE GOMES,F,16/03/1972,Válido,23
23270,86,Não eleito,CLEONIRA CASTRO DE AZEVEDO,CLEONIRA CASTRO,F,18/11/1971,Válido,23
23345,253,Não eleito,JOSIANE IZABEL DA ROCHA,JOSIANE DA JOPLIN,F,28/10/1969,Válido,23
23300,27,Não eleito,MAURÍLIO PEREIRA JÚNIOR MALDONADO,MAURÍLIO MALDONADO,M,26/08/1984,Válido,23
23111,67,Não eleito,NEIRLENE DOS SANTOS SILVA REIMANN,NEIRLENE REIMANN,F,26/10/1969,Válido,23
25800,230,Suplente,ANA FLÁVIA DO NASCIMENTO,FLÁVIA DE JACI PARANÁ,F,05/04/1973,Válido,25
25000,392,Suplente,ANDREA VIRGINIA FARIAS LIMA,ANDREA FARIAS,F,18/08/1983,Válido,25
25555,749,Suplente,CRISTIANO LOPES FERREIRA,CRISTIANO LOPES,M,11/09/1976,Válido,25
25300,53,Suplente,HANS MULLER MIZAEL DE OLIVEIRA,HANS MULLER,M,29/07/1994,Válido,25
25010,2,Não eleito,VANDY PAIVA DE AMORIM,VANDY AMORIM,M,11/12/1969,Anulado sub judice,25
25333,642,Suplente,ADRIANO DE CASTRO,ADRIANO DE CASTRO,M,18/11/1975,Válido,25
25265,251,Suplente,ALDEMIR FERREIRA DOS SANTOS,EDINHO SANTOS,M,19/06/1970,Válido,25
25500,1533,Eleito,WALDISON FREITAS NEVES,VALTINHO CANUTO,M,15/12/1967,Válido,25
25123,1035,Suplente,EDCARLOS SOARES DA SILVA,EDCARLOS,M,03/05/1975,Válido,25
25007,4,Suplente,VERA LÚCIA COSTA DA SILVA,VERA DO LAGOA AZUL,F,07/12/1983,Válido,25
25100,232,Suplente,JORGE RIBEIRO DE LIMA,JORGE LIMA,M,27/07/1977,Válido,25
25111,1061,Suplente,ITAMAR PEREIRA RIBEIRO,ITAMAR GURGEL,M,14/04/1982,Válido,25
25147,931,Suplente,SEVERINO DOS RAMOS MARCELINO DA SILVA,SEVERINO RAMOS,M,23/10/1962,Válido,25
25190,166,Suplente,FRANCISCO LEANDRO DE LIMA SILVA,LEANDRO LIMA,M,17/09/1978,Válido,25
25678,46,Suplente,ANGELINA LOPES DE MENEZES,ANGELINA MENEZES,F,14/01/1975,Válido,25
25777,132,Suplente,CHARLES NOVAES DE ALMEIDA,DR CHARLES CORAÇÃO,M,01/03/1975,Válido,25
25888,47,Suplente,CLAUDIA EVELENE BARROS RIBEIRO,CLAUDIA SOL DESPACHANTE,F,27/08/1972,Válido,25
25222,62,Suplente,VANIA JOELMA MORALES PILON,VANIA DA LOJA COM AMOR,F,27/02/1967,Válido,25
25700,539,Suplente,PABLO DE OLIVEIRA BEZERRA,PABLO OLIVEIRA,M,20/04/1991,Válido,25
25600,70,Suplente,ILTON ROBERTO KRAMER,PROF ILTON KRAMER,M,09/07/1967,Válido,25
25200,81,Suplente,GILMAR TIMOTEO DA SILVA,TENENTE TIMOTEO,M,25/09/1956,Válido,25
25525,149,Suplente,SÉRGIO MONTENEGRO DE OLIVEIRA,PROF SÉRGIO MONTENEGRO,M,04/04/1959,Válido,25
25456,143,Suplente,RAIMUNDA ROSAS VIEIRA,ROSINHA VIEIRA,F,10/06/1987,Válido,25
65067,20,Não eleito,CARLOS CUNHA DA SILVA,CARLOS CUNHA,M,04/02/1967,Válido,65
65166,45,Não eleito,GUILHERME HENRIQUE DA SILVA BARROS,ATENA BARROS,M,17/12/2000,Válido,65
65200,66,Não eleito,LEONY FABIANO DOS SANTOS TAVARES,DR LEONY FABIANO,M,11/12/1985,Válido,65
65065,117,Não eleito,NIEDJA VIRGINIA FELIX DE SANTANA,NIEDJA SANTANA,F,19/07/1978,Válido,65
65130,1697,Não eleito,CLAUDIO HÉLIO DE SALES,CLAUDIO DA PADARIA,M,23/09/1970,Válido,65
65678,48,Não eleito,JOSE GOMES DE LIMA,JOSE GOMES,M,23/02/1938,Válido,65
65061,9,Não eleito,JOÃO TEIXEIRA DE MELO,TEIXEIRINHA,M,20/08/1959,Válido,65
65165,5,Não eleito,ALEXSANDRO BRAGA SERRÃO,DÚ ALEX,M,06/09/1973,Anulado sub judice,65
65244,11,Não eleito,LENAVAYNE LEITE DE ARAUJO,LENAVAYNE,F,24/02/1972,Válido,65
65193,22,Não eleito,RICARDO ANDRÉ FONSECA PINTO,SARGENTO FONSECA,M,05/05/1979,Válido,65
65001,25,Não eleito,PEDRO ADÃO DE CANTALISTA LIMA,PEDRO ADÃO,M,20/01/1974,Válido,65
65250,10,Não eleito,ANDRESSA BATISTA DA COSTA,ANDRESSA,F,23/03/1997,Válido,65
65007,75,Não eleito,VANDERLEI GONÇALVES DA SILVA,RISADINHA,M,17/12/1967,Válido,65
65123,219,Não eleito,HIAGO RIBEIRO GONÇALVES,HIAGO GONÇALVES,M,06/05/1992,Válido,65
65227,133,Não eleito,JOELSON CHAVES DE QUEIROZ,PROFESSOR JOELSON,M,18/03/1958,Válido,65
65234,45,Não eleito,FERNANDO BATISTA DA SILVA,FERNANDO BATISTA,M,19/12/1962,Válido,65
65321,69,Não eleito,WALDEYNA RODRIGUES MORAES DE ARAUJO,WAL MORAES,F,15/02/1979,Válido,65
65333,945,Não eleito,RAIMUNDO COSTA DE MORAES,DR RAIMUNDINHO BIKE SOM,M,15/07/1976,Válido,65
65555,80,Não eleito,MICHELE ROJAS ANEZ,MICHELE ANEZ,F,06/11/1997,Válido,65
65122,48,Não eleito,ELEVALDO SILVA DE SOUZA,HELIO CABELUDO,M,18/05/1983,Válido,65
65666,68,Não eleito,AMAURI PEREIRA LEAL,AMAURI LEAL,M,19/11/1974,Válido,65
65222,28,Não eleito,RAIMUNDA RIBEIRO,DIQUINHA,F,25/02/1964,Válido,65
65015,21,Não eleito,MARIA RAQUEL PRADO AGUIAR,RAQUEL PRADO,F,24/11/1977,Válido,65
65556,46,Não eleito,JOICE REGINA SANTANA DA SILVA,JOICE UBER,F,03/04/1989,Válido,65
65274,12,Não eleito,WILLISON DUARTE DE LIMA JUNIOR,JUNIOR LIMA,M,22/10/1997,Válido,65
12222,217,Não eleito,ADRIANO DA SILVA FREIRE,ADRIANO FREIRE,M,17/03/1981,Válido,12
12190,675,Não eleito,RAIMUNDO ROSINALDO COSTA GUEDES,ROSINALDO GUEDES,M,19/04/1969,Válido,12
12567,31,Não eleito,MAIARA SANTOS RODRIGUES,MAIARA SANTOS,F,30/01/1992,Válido,12
12300,724,Não eleito,VALNEI GOMES DA CRUZ ROCHA,VALNEI ROCHA,M,10/07/1981,Válido,12
12900,56,Não eleito,MARIA DO ROSARIO MENEZES DA SILVA,MARIA DA TAPIOCA,F,06/09/1960,Válido,12
12778,232,Não eleito,NATANAEL COSTA PRESTES,NATANAEL COSTA MESTRE DRAGÃO,M,30/10/1972,Válido,12
12180,179,Não eleito,FELIPE DE OLIVEIRA PEREIRA,FELIPE OLIVEIRA,M,30/04/1986,Válido,12
12334,77,Não eleito,VALDIVINO PEREIRA DA CRUZ FILHO,VALDIVINO FILHO,M,08/11/1977,Válido,12
12321,198,Não eleito,TIAGO DE LIMA MELO,TIAGO LIMA,M,30/09/1989,Válido,12
12456,18,Não eleito,LIZANIA KATTY XIMENES ALVES,LIZANIA KATTY,F,26/03/1979,Válido,12
12001,114,Não eleito,MARCIA DUARTE DORNELES SILVA,MARCIA DUARTE,F,22/03/1985,Válido,12
12193,67,Não eleito,CARLOS CRISTIANO DA SILVA DE OLIVEIRA,CRISTIANO NANDO,M,29/12/1977,Válido,12
12333,85,Não eleito,MANOEL MESSIAS DA SILVA OLIVEIRA,MANOEL MESSIAS,M,09/10/1970,Válido,12
12345,1714,Não eleito,ADA CLEIA SICHINEL DANTAS BOABAID,ADA DANTAS BOABAID,F,15/08/1984,Válido,12
12442,68,Não eleito,SAMUEL DOS SANTOS SILVA,SAMUEL SANTOS,M,22/02/1992,Válido,12
12678,119,Não eleito,CARLOS GLENAN DE ARAUJO,CARLOS DO LAGOINHA,M,24/11/1963,Válido,12
12577,23,Não eleito,ANTONIO SAVIO AMBROSIO DOS REIS,ANTONIO SAVIO,M,07/07/1965,Válido,12
12000,220,Não eleito,TÉO MARIO DOS SANTOS PEREIRA,TEO SANTOS,M,25/06/1977,Válido,12
12789,30,Não eleito,SHEILA PEREIRA RODRIGUES,SHEILA RODRIGUES,F,03/08/1969,Válido,12
12500,47,Não eleito,EDSON JOSE DE ARAUJO FILHO,EDSON ARAUJO,M,04/09/1979,Válido,12
12123,307,Não eleito,ANNE PABLICIA BARBOSA NUNES MAMEDES,PROFESSORA ANNE MAMEDES,F,19/12/1975,Válido,12
12364,404,Não eleito,OLAKSON PINTO PEDROSA,PROFESSOR OLAKSON PEDROSA,M,20/11/1969,Válido,12
11011,163,Suplente,JORGE LIRA SOUZA,JORGE LIRA,M,25/03/1957,Válido,11
11200,116,Suplente,ELIZANGELA PEREIRA DA CUNHA LOPES,ELIZÂNGELA PEREIRA,F,02/08/1992,Válido,11
11444,109,Suplente,ADISLEI DA SILVA GONZAGA,ADISLEI GONZAGA,M,06/11/1984,Válido,11
11888,41,Suplente,WALISSON RICHARD FREITAS DE AMORIM,WALISSON DE AMORIM,M,21/07/1996,Válido,11
11777,65,Suplente,JEFFERSON FRANCISCO NETO,JEFINHO,M,12/11/1972,Válido,11
11000,300,Suplente,JONES DARLIN BARBOSA FREITAS,JONES DARLIN,M,23/06/1991,Válido,11
11900,28,Suplente,RAIMUNDA NONATA FERREIRA MOTA,OLINDA FERREIRA,F,01/11/1966,Válido,11
11112,572,Suplente,DOUGLAS BENER MAIA OLIVEIRA,DOUGLAS BENER,M,25/10/1992,Válido,11
11009,204,Suplente,FRANCISCO DE ASSIS DE OLIVEIRA XAVIER,ASSIS XAVIER,M,29/03/1980,Válido,11
11007,426,Suplente,CARLOS AUGUSTO SILVA BRAGA,CARLINHOS BRAGA,M,04/06/1960,Válido,11
11456,147,Suplente,CLAUDEIR PEREIRA NETTO,CLAUDEIR NETTO,M,30/12/1981,Válido,11
11300,140,Suplente,ANDRÉ LUIS D'ANDREA MENDES,ANDRÉ D'ANDREA,M,28/01/1964,Válido,11
11321,79,Suplente,ARLINDO SOUZA MONTEIRO,ARLINDO MONTEIRO,M,27/01/1987,Válido,11
